"Text","Binary_Sentiment","Cont_Sentiment"
"some  children dressed in tattered brocades played at quoits on the outskirts","0.0","-2.730008602142334"
"our travellers from the other world amused themselves by looking on","0.0","-16.044532775878906"
"the  quoits were large round pieces, yellow, red, and green, which cast a  singular lustre!","1.0","8.1858749389648438"
"the travellers picked a few of them off the ground   this was of gold, that of emeralds, the other of rubies  the least of  them would have been the greatest ornament on the mogul's throne","0.0","-3.9595942497253418"
"without doubt,  said cacambo,  these children must be the king's sons  that are playing at quoits!","1.0","4.8828425407409668"
"the village schoolmaster appeared at this moment and called them to  school","0.0","-4.1323237419128418"
"there,  said candide,  is the preceptor of the royal family","1.0","1.5303530693054199"
"the little truants immediately quitted their game, leaving the quoits  on the ground with all their other playthings","0.0","-2.9305763244628906"
"candide gathered them up,  ran to the master, and presented them to him in a most humble manner,  giving him to understand by signs that their royal highnesses had  forgotten their gold and jewels","1.0","4.9206838607788086"
"the schoolmaster, smiling, flung them  upon the ground  then, looking at candide with a good deal of surprise,  went about his business","0.0","-4.4517722129821777"
"the travellers, however, took care to gather up the gold, the rubies,  and the emeralds","1.0","3.5469398498535156"
"where are we?","1.0","4.2124805450439453"
"cried candide","0.0","-4.9077019691467285"
"the king's children in this country must  be well brought up, since they are taught to despise gold and precious  stones","1.0","4.7742714881896973"
"cacambo was as much surprised as candide","1.0","2.7695622444152832"
"at length they drew near the  first house in the village","0.0","-6.2603826522827148"
"it was built like an european palace","0.0","-1.5461574792861938"
"a  crowd of people pressed about the door, and there were still more in the  house","0.0","-5.012202262878418"
"they heard most agreeable music, and were aware of a delicious  odour of cooking","1.0","7.9656381607055664"
"cacambo went up to the door and heard they were  talking peruvian  it was his mother tongue, for it is well known that  cacambo was born in tucuman, in a village where no other language was  spoken","1.0","0.34505969285964966"
"i will be your interpreter here,  said he to candide   let us go in, it  is a public house","1.0","1.1790399551391602"
"immediately two waiters and two girls, dressed in cloth of gold, and  their hair tied up with ribbons, invited them to sit down to table with  the landlord","0.0","-4.4553346633911133"
"they served four dishes of soup, each garnished with two  young parrots  a boiled condor 19  which weighed two hundred pounds  two  roasted monkeys, of excellent flavour  three hundred humming birds in  one dish, and six hundred fly birds in another  exquisite ragouts   delicious pastries  the whole served up in dishes of a kind of  rock crystal","0.0","-8.5803775787353516"
"the waiters and girls poured out several liqueurs drawn  from the sugar cane","1.0","4.1599597930908203"
"most of the company were chapmen and waggoners, all extremely polite   they asked cacambo a few questions with the greatest circumspection, and  answered his in the most obliging manner","1.0","1.3626308441162109"
"as soon as dinner was over, cacambo believed as well as candide that  they might well pay their reckoning by laying down two of those large  gold pieces which they had picked up","0.0","-1.3227195739746094"
"the landlord and landlady shouted  with laughter and held their sides","1.0","7.906825065612793"
"when the fit was over      gentlemen,  said the landlord,  it is plain you are strangers, and such  guests we are not accustomed to see  pardon us therefore for laughing  when you offered us the pebbles from our highroads in payment of your  reckoning","0.0","-3.642664909362793"
"you doubtless have not the money of the country  but it is  not necessary to have any money at all to dine in this house","0.0","-5.596341609954834"
"all  hostelries established for the convenience of commerce are paid by the  government","1.0","2.1645865440368652"
"you have fared but very indifferently because this is a poor  village  but everywhere else, you will be received as you deserve","0.0","-5.5226349830627441"
"cacambo explained this whole discourse with great astonishment to  candide, who was as greatly astonished to hear it","1.0","6.2188539505004883"
"what sort of a country then is this,  said they to one another   a  country unknown to all the rest of the world, and where nature is of a  kind so different from ours?","0.0","-7.6586990356445312"
"it is probably the country where all is  well  for there absolutely must be one such place","1.0","2.4765985012054443"
"and, whatever master  pangloss might say, i often found that things went very ill in  westphalia","0.0","-6.094548225402832"
"xviii    what they saw in the country of el dorado","1.0","2.1152341365814209"
"cacambo expressed his curiosity to the landlord, who made answer      i am very ignorant, but not the worse on that account","0.0","-0.15027165412902832"
"however, we have  in this neighbourhood an old man retired from court who is the most  learned and most communicative person in the kingdom","0.0","-13.266386032104492"
"at once he took cacambo to the old man","1.0","5.3901576995849609"
"candide acted now only a second  character, and accompanied his valet","1.0","7.5862941741943359"
"they entered a very plain house,  for the door was only of silver, and the ceilings were only of gold, but  wrought in so elegant a taste as to vie with the richest","0.0","-6.6978235244750977"
"the  antechamber, indeed, was only encrusted with rubies and emeralds, but  the order in which everything was arranged made amends for this great  simplicity","1.0","4.1409802436828613"
"the old man received the strangers on his sofa, which was stuffed with  humming birds' feathers, and ordered his servants to present them with  liqueurs in diamond goblets  after which he satisfied their curiosity  in the following terms      i am now one hundred and seventy two years old, and i learnt of my late  father, master of the horse to the king, the amazing revolutions of  peru, of which he had been an eyewitness","1.0","5.30780029296875"
"the kingdom we now inhabit is  the ancient country of the incas, who quitted it very imprudently to  conquer another part of the world, and were at length destroyed by the  spaniards","0.0","-5.6917300224304199"
"more wise by far were the princes of their family, who remained in  their native country  and they ordained, with the consent of the whole  nation, that none of the inhabitants should ever be permitted to quit  this little kingdom  and this has preserved our innocence and happiness","0.0","-1.8954558372497559"
"the spaniards have had a confused notion of this country, and have  called it  el dorado   and an englishman, whose name was sir walter  raleigh, came very near it about a hundred years ago  but being  surrounded by inaccessible rocks and precipices, we have hitherto been  sheltered from the rapaciousness of european nations, who have an  inconceivable passion for the pebbles and dirt of our land, for the sake  of which they would murder us to the last man","0.0","-3.4264185428619385"
"the conversation was long  it turned chiefly on their form of  government, their manners, their women, their public entertainments,  and the arts","0.0","-3.190312385559082"
"at length candide, having always had a taste for  metaphysics, made cacambo ask whether there was any religion in that  country","0.0","-6.6079816818237305"
"the old man reddened a little","1.0","4.0782909393310547"
"how then,  said he,  can you doubt it?","1.0","4.3374423980712891"
"do you take us for ungrateful  wretches?","1.0","4.7422361373901367"
"cacambo humbly asked,  what was the religion in el dorado?","1.0","2.8480775356292725"
"the old man reddened again","1.0","4.551152229309082"
"can there be two religions?","1.0","4.8449716567993164"
"said he","1.0","1.8730843067169189"
"we have, i believe, the religion  of all the world  we worship god night and morning","0.0","-3.8261005878448486"
"do you worship but one god?","1.0","2.5778334140777588"
"said cacambo, who still acted as  interpreter in representing candide's doubts","1.0","4.5523042678833008"
"surely,  said the old man,  there are not two, nor three, nor four","1.0","1.7385344505310059"
"i  must confess the people from your side of the world ask very  extraordinary questions","1.0","2.6344356536865234"
"candide was not yet tired of interrogating the good old man  he wanted  to know in what manner they prayed to god in el dorado","0.0","-0.20517969131469727"
"we do not pray to him,  said the worthy sage   we have nothing to ask  of him  he has given us all we need, and we return him thanks without  ceasing","0.0","-7.2522706985473633"
"candide having a curiosity to see the priests asked where they were","0.0","-3.7571310997009277"
"the good old man smiled","1.0","5.6129269599914551"
"my friend,  said he,  we are all priests","1.0","1.2922563552856445"
"the king and all the heads of  families sing solemn canticles of thanksgiving every morning,  accompanied by five or six thousand musicians","1.0","1.1451904773712158"
"what!","1.0","3.4411015510559082"
"have you no monks who teach, who dispute, who govern, who cabal,  and who burn people that are not of their opinion?","1.0","6.5630683898925781"
"we must be mad, indeed, if that were the case,  said the old man   here  we are all of one opinion, and we know not what you mean by monks","1.0","0.043951988220214844"
"during this whole discourse candide was in raptures, and he said to  himself      this is vastly different from westphalia and the baron's castle","1.0","1.7238576412200928"
"had  our friend pangloss seen el dorado he would no longer have said that the  castle of thunder ten tronckh was the finest upon earth","0.0","-7.6724300384521484"
"it is evident  that one must travel","1.0","1.5390694141387939"
"after this long conversation the old man ordered a coach and six sheep  to be got ready, and twelve of his domestics to conduct the travellers  to court","0.0","-5.2127866744995117"
"excuse me,  said he,  if my age deprives me of the honour of  accompanying you","0.0","-3.0399246215820312"
"the king will receive you in a manner that cannot  displease you  and no doubt you will make an allowance for the customs  of the country, if some things should not be to your liking","1.0","5.5949859619140625"
"candide and cacambo got into the coach, the six sheep flew, and in less  than four hours they reached the king's palace situated at the extremity  of the capital","1.0","4.0142669677734375"
"the portal was two hundred and twenty feet high, and one  hundred wide  but words are wanting to express the materials of which it  was built","0.0","-1.5402731895446777"
"it is plain such materials must have prodigious superiority  over those pebbles and sand which we call gold and precious stones","0.0","-2.7862584590911865"
"twenty beautiful damsels of the king's guard received candide and  cacambo as they alighted from the coach, conducted them to the bath, and  dressed them in robes woven of the down of humming birds  after which  the great crown officers, of both sexes, led them to the king's  apartment, between two files of musicians, a thousand on each side","0.0","-1.6861875057220459"
"when  they drew near to the audience chamber cacambo asked one of the great  officers in what way he should pay his obeisance to his majesty  whether  they should throw themselves upon their knees or on their stomachs   whether they should put their hands upon their heads or behind their  backs  whether they should lick the dust off the floor  in a word, what  was the ceremony?","1.0","3.833796501159668"
"the custom,  said the great officer,  is to embrace the king, and to  kiss him on each cheek","1.0","5.2865138053894043"
"candide and cacambo threw themselves round his majesty's neck","1.0","3.2739739418029785"
"he  received them with all the goodness imaginable, and politely invited  them to supper","1.0","8.6546649932861328"
"while waiting they were shown the city, and saw the public edifices  raised as high as the clouds, the market places ornamented with a  thousand columns, the fountains of spring water, those of rose water,  those of liqueurs drawn from sugar cane, incessantly flowing into the  great squares, which were paved with a kind of precious stone, which  gave off a delicious fragrancy like that of cloves and cinnamon","1.0","3.8066978454589844"
"candide  asked to see the court of justice, the parliament","0.0","-1.5023391246795654"
"they told him they  had none, and that they were strangers to lawsuits","1.0","1.5441312789916992"
"he asked if they had  any prisons, and they answered no","1.0","3.881983757019043"
"but what surprised him most and gave  him the greatest pleasure was the palace of sciences, where he saw a  gallery two thousand feet long, and filled with instruments employed in  mathematics and physics","1.0","1.724879264831543"
"after rambling about the city the whole afternoon, and seeing but a  thousandth part of it, they were reconducted to the royal palace, where  candide sat down to table with his majesty, his valet cacambo, and  several ladies","0.0","-4.4184932708740234"
"never was there a better entertainment, and never was  more wit shown at a table than that which fell from his majesty","0.0","-8.734710693359375"
"cacambo  explained the king's  bon mots  to candide, and notwithstanding they  were translated they still appeared to be  bon mots","0.0","-0.70510363578796387"
"of all the things  that surprised candide this was not the least","1.0","2.974217414855957"
"they spent a month in this hospitable place","0.0","-2.9694187641143799"
"candide frequently said to  cacambo      i own, my friend, once more that the castle where i was born is nothing  in comparison with this  but, after all, miss cunegonde is not here, and  you have, without doubt, some mistress in europe","1.0","1.1477236747741699"
"if we abide here we  shall only be upon a footing with the rest, whereas, if we return to our  old world, only with twelve sheep laden with the pebbles of el dorado,  we shall be richer than all the kings in europe","1.0","0.66970300674438477"
"we shall have no more  inquisitors to fear, and we may easily recover miss cunegonde","0.0","-7.1192817687988281"
"this speech was agreeable to cacambo  mankind are so fond of roving, of  making a figure in their own country, and of boasting of what they have  seen in their travels, that the two happy ones resolved to be no longer  so, but to ask his majesty's leave to quit the country","1.0","4.8648834228515625"
"you are foolish,  said the king","0.0","-0.096741199493408203"
"i am sensible that my kingdom is but  a small place, but when a person is comfortably settled in any part he  should abide there","1.0","1.9972302913665771"
"i have not the right to detain strangers","1.0","0.92926716804504395"
"it is a  tyranny which neither our manners nor our laws permit","0.0","-0.69980388879776001"
"all men are free","0.0","-7.4963188171386719"
"go when you wish, but the going will be very difficult","1.0","1.8676247596740723"
"it is impossible  to ascend that rapid river on which you came as by a miracle, and which  runs under vaulted rocks","1.0","1.9265148639678955"
"the mountains which surround my kingdom are  ten thousand feet high, and as steep as walls  they are each over ten  leagues in breadth, and there is no other way to descend them than by  precipices","0.0","-8.1328420639038086"
"however, since you absolutely wish to depart, i shall give  orders to my engineers to construct a machine that will convey you very  safely","0.0","-10.733013153076172"
"when we have conducted you over the mountains no one can  accompany you further, for my subjects have made a vow never to quit the  kingdom, and they are too wise to break it","0.0","-6.241424560546875"
"ask me besides anything that  you please","0.0","-7.6990079879760742"
"we desire nothing of your majesty,  says candide,  but a few sheep  laden with provisions, pebbles, and the earth of this country","1.0","0.38684928417205811"
"the king laughed","1.0","1.3126835823059082"
"i cannot conceive,  said he,  what pleasure you europeans find in our  yellow clay, but take as much as you like, and great good may it do  you","1.0","5.8133306503295898"
"at once he gave directions that his engineers should construct a machine  to hoist up these two extraordinary men out of the kingdom","0.0","-6.0779218673706055"
"three  thousand good mathematicians went to work  it was ready in fifteen days,  and did not cost more than twenty million sterling in the specie of that  country","0.0","-11.725321769714355"
"they placed candide and cacambo on the machine","1.0","7.6488399505615234"
"there were two  great red sheep saddled and bridled to ride upon as soon as they were  beyond the mountains, twenty pack sheep laden with provisions, thirty  with presents of the curiosities of the country, and fifty with gold,  diamonds, and precious stones","1.0","1.0253276824951172"
"the king embraced the two wanderers very  tenderly","1.0","3.1525366306304932"
"their departure, with the ingenious manner in which they and their sheep  were hoisted over the mountains, was a splendid spectacle","1.0","6.2268657684326172"
"the  mathematicians took their leave after conveying them to a place of  safety, and candide had no other desire, no other aim, than to present  his sheep to miss cunegonde","1.0","1.1981024742126465"
"now,  said he,  we are able to pay the governor of buenos ayres if miss  cunegonde can be ransomed","1.0","0.16964387893676758"
"let us journey towards cayenne","1.0","6.0844402313232422"
"let us  embark, and we will afterwards see what kingdom we shall be able to  purchase","0.0","-5.2185893058776855"
"xix    what happened to them at surinam and how candide got acquainted with  martin","0.0","-1.8237602710723877"
"our travellers spent the first day very agreeably","0.0","-15.717015266418457"
"they were delighted  with possessing more treasure than all asia, europe, and africa could  scrape together","1.0","3.8635058403015137"
"candide, in his raptures, cut cunegonde's name on the  trees","1.0","0.72000646591186523"
"the second day two of their sheep plunged into a morass, where  they and their burdens were lost  two more died of fatigue a few days  after  seven or eight perished with hunger in a desert  and others  subsequently fell down precipices","1.0","6.5135035514831543"
"at length, after travelling a hundred  days, only two sheep remained","0.0","-5.9245615005493164"
"said candide to cacambo      my friend, you see how perishable are the riches of this world  there  is nothing solid but virtue, and the happiness of seeing cunegonde once  more","1.0","4.4738879203796387"
"i grant all you say,  said cacambo,  but we have still two sheep  remaining, with more treasure than the king of spain will ever have  and  i see a town which i take to be surinam, belonging to the dutch","1.0","1.4679937362670898"
"we are  at the end of all our troubles, and at the beginning of happiness","1.0","1.6770627498626709"
"as they drew near the town, they saw a negro stretched upon the ground,  with only one moiety of his clothes, that is, of his blue linen drawers   the poor man had lost his left leg and his right hand","0.0","-2.9283533096313477"
"good god!","1.0","9.3958702087402344"
"said candide in dutch,  what art thou doing there, friend,  in that shocking condition?","1.0","0.56398153305053711"
"i am waiting for my master, mynheer vanderdendur, the famous merchant,   answered the negro","1.0","2.5190305709838867"
"was it mynheer vanderdendur,  said candide,  that treated thee thus?","0.0","-2.9544188976287842"
"yes, sir,  said the negro,  it is the custom","0.0","-3.042414665222168"
"they give us a pair of  linen drawers for our whole garment twice a year","0.0","-3.2278070449829102"
"when we work at the  sugar canes, and the mill snatches hold of a finger, they cut off the  hand  and when we attempt to run away, they cut off the leg  both cases  have happened to me","0.0","-4.5009708404541016"
"this is the price at which you eat sugar in europe","1.0","1.8266077041625977"
"yet when my mother sold me for ten patagons 20  on the coast of guinea,  she said to me  'my dear child, bless our fetiches, adore them for ever   they will make thee live happily  thou hast the honour of being the  slave of our lords, the whites, which is making the fortune of thy  father and mother '","0.0","-0.011815547943115234"
"alas!","0.0","-8.5570907592773438"
"i know not whether i have made their fortunes   this i know, that they have not made mine","0.0","-1.6449285745620728"
"dogs, monkeys, and parrots  are a thousand times less wretched than i","0.0","-9.2950811386108398"
"the dutch fetiches, who have  converted me, declare every sunday that we are all of us children of  adam  blacks as well as whites","0.0","-2.6407802104949951"
"i am not a genealogist, but if these  preachers tell truth, we are all second cousins","1.0","1.6122310161590576"
"now, you must agree,  that it is impossible to treat one's relations in a more barbarous  manner","1.0","2.6747453212738037"
"oh, pangloss!","1.0","0.19499659538269043"
"cried candide,  thou hadst not guessed at this  abomination  it is the end","0.0","-5.0471749305725098"
"i must at last renounce thy optimism","1.0","5.4651675224304199"
"what is this optimism?","1.0","2.4835329055786133"
"said cacambo","1.0","3.282764196395874"
"alas!","0.0","-8.5570907592773438"
"said candide,  it is the madness of maintaining that everything  is right when it is wrong","0.0","-5.1687078475952148"
"looking at the negro, he shed tears, and weeping, he entered surinam","1.0","5.5654253959655762"
"the first thing they inquired after was whether there was a vessel in  the harbour which could be sent to buenos ayres","0.0","-3.733971118927002"
"the person to whom they  applied was a spanish sea captain, who offered to agree with them upon  reasonable terms","0.0","-3.1217598915100098"
"he appointed to meet them at a public house, whither  candide and the faithful cacambo went with their two sheep, and awaited  his coming","0.0","-2.1532776355743408"
"candide, who had his heart upon his lips, told the spaniard all his  adventures, and avowed that he intended to elope with miss cunegonde","1.0","2.6063365936279297"
"then i will take good care not to carry you to buenos ayres,  said the  seaman","1.0","5.1003069877624512"
"i should be hanged, and so would you","1.0","3.3996639251708984"
"the fair cunegonde is my  lord's favourite mistress","1.0","4.6114487648010254"
"this was a thunderclap for candide  he wept for a long while","1.0","2.9504885673522949"
"at last he  drew cacambo aside","1.0","4.1784443855285645"
"here, my dear friend,  said he to him,  this thou must do","1.0","0.47919058799743652"
"we have,  each of us in his pocket, five or six millions in diamonds  you are more  clever than i  you must go and bring miss cunegonde from buenos ayres","1.0","1.0087563991546631"
"if the governor makes any difficulty, give him a million  if he will not  relinquish her, give him two  as you have not killed an inquisitor, they  will have no suspicion of you  i'll get another ship, and go and wait  for you at venice  that's a free country, where there is no danger  either from bulgarians, abares, jews, or inquisitors","1.0","1.2802178859710693"
"cacambo applauded this wise resolution","1.0","2.9913382530212402"
"he despaired at parting from so  good a master, who had become his intimate friend  but the pleasure of  serving him prevailed over the pain of leaving him","0.0","-3.3107109069824219"
"they embraced with  tears  candide charged him not to forget the good old woman","1.0","8.1071243286132812"
"cacambo  set out that very same day","0.0","-3.365117073059082"
"this cacambo was a very honest fellow","1.0","2.8015944957733154"
"candide stayed some time longer in surinam, waiting for another captain  to carry him and the two remaining sheep to italy","1.0","3.8137919902801514"
"after he had hired  domestics, and purchased everything necessary for a long voyage, mynheer  vanderdendur, captain of a large vessel, came and offered his services","0.0","-3.3814132213592529"
"how much will you charge,  said he to this man,  to carry me straight  to venice  me, my servants, my baggage, and these two sheep?","1.0","4.1633787155151367"
"the skipper asked ten thousand piastres","0.0","-5.1302237510681152"
"candide did not hesitate","1.0","0.18391698598861694"
"oh!","0.0","-0.76267194747924805"
"oh!","0.0","-0.76267194747924805"
"said the prudent vanderdendur to himself,  this stranger gives  ten thousand piastres unhesitatingly!","0.0","-1.2300655841827393"
"he must be very rich","1.0","6.521721363067627"
"returning a little while after, he let him know that upon second  consideration, he could not undertake the voyage for less than twenty  thousand piastres","1.0","7.9259490966796875"
"well, you shall have them,  said candide","0.0","-6.059809684753418"
"ay!","1.0","4.2881808280944824"
"said the skipper to himself,  this man agrees to pay twenty  thousand piastres with as much ease as ten","0.0","-3.1843204498291016"
"he went back to him again, and declared that he could not carry him to  venice for less than thirty thousand piastres","0.0","-7.0644235610961914"
