"Text","Binary_Sentiment","Cont_Sentiment"
"they sat down to table with paquette and the theatin  the repast  was entertaining  and towards the end they conversed with all  confidence","0.0","-1.5388467311859131"
"father,  said candide to the friar,  you appear to me to enjoy a state  that all the world might envy  the flower of health shines in your face,  your expression makes plain your happiness  you have a very pretty girl  for your recreation, and you seem well satisfied with your state as a  theatin","0.0","-0.15999889373779297"
"my faith, sir,  said friar girofl e,  i wish that all the theatins were  at the bottom of the sea","0.0","-0.5625343918800354"
"i have been tempted a hundred times to set  fire to the convent, and go and become a turk","0.0","-5.7504701614379883"
"my parents forced me at  the age of fifteen to put on this detestable habit, to increase the  fortune of a cursed elder brother, whom god confound","0.0","-2.7106716632843018"
"jealousy, discord,  and fury, dwell in the convent","0.0","-0.41584920883178711"
"it is true i have preached a few bad  sermons that have brought me in a little money, of which the prior stole  half, while the rest serves to maintain my girls  but when i return at  night to the monastery, i am ready to dash my head against the walls of  the dormitory  and all my fellows are in the same case","0.0","-2.027714729309082"
"martin turned towards candide with his usual coolness","1.0","2.0657773017883301"
"well,  said he,  have i not won the whole wager?","0.0","-3.5347752571105957"
"candide gave two thousand piastres to paquette, and one thousand to  friar girofl e","0.0","-6.8859491348266602"
"i'll answer for it,  said he,  that with this they will be happy","1.0","3.8364682197570801"
"i do not believe it at all,  said martin   you will, perhaps, with  these piastres only render them the more unhappy","1.0","3.6251792907714844"
"let that be as it may,  said candide,  but one thing consoles me","0.0","-1.4650607109069824"
"i see  that we often meet with those whom we expected never to see more  so  that, perhaps, as i have found my red sheep and paquette, it may well be  that i shall also find cunegonde","0.0","-2.6779079437255859"
"i wish,  said martin,  she may one day make you very happy  but i doubt  it very much","0.0","-3.1123371124267578"
"you are very hard of belief,  said candide","1.0","0.83747434616088867"
"i have lived,  said martin","1.0","0.56045222282409668"
"you see those gondoliers,  said candide,  are they not perpetually  singing?","0.0","-1.4444215297698975"
"you do not see them,  said martin,  at home with their wives and brats","0.0","-1.5595695972442627"
"the doge has his troubles, the gondoliers have theirs","1.0","4.3041896820068359"
"it is true that,  all things considered, the life of a gondolier is preferable to that of  a doge  but i believe the difference to be so trifling that it is not  worth the trouble of examining","0.0","-2.0325257778167725"
"people talk,  said candide,  of the senator pococurante, who lives in  that fine palace on the brenta, where he entertains foreigners in the  politest manner","1.0","7.9607586860656738"
"they pretend that this man has never felt any  uneasiness","1.0","4.0335874557495117"
"i should be glad to see such a rarity,  said martin","1.0","5.7576580047607422"
"candide immediately sent to ask the lord pococurante permission to wait  upon him the next day","0.0","-6.0011014938354492"
"xxv    the visit to lord pococurante, a noble venetian","1.0","1.0809962749481201"
"candide and martin went in a gondola on the brenta, and arrived at the  palace of the noble signor pococurante","0.0","-0.046395301818847656"
"the gardens, laid out with  taste, were adorned with fine marble statues","1.0","6.7108254432678223"
"the palace was beautifully  built","1.0","1.9540845155715942"
"the master of the house was a man of sixty, and very rich","0.0","-0.19346797466278076"
"he  received the two travellers with polite indifference, which put candide  a little out of countenance, but was not at all disagreeable to martin","0.0","-0.37134003639221191"
"first, two pretty girls, very neatly dressed, served them with  chocolate, which was frothed exceedingly well","0.0","-1.9427776336669922"
"candide could not refrain  from commending their beauty, grace, and address","1.0","5.3374500274658203"
"they are good enough creatures,  said the senator","1.0","8.6962299346923828"
"i make them lie  with me sometimes, for i am very tired of the ladies of the town, of  their coquetries, of their jealousies, of their quarrels, of their  humours, of their pettinesses, of their prides, of their follies, and of  the sonnets which one must make, or have made, for them","1.0","0.12563896179199219"
"but after all,  these two girls begin to weary me","0.0","-5.1506996154785156"
"after breakfast, candide walking into a long gallery was surprised by  the beautiful pictures","0.0","-1.175494909286499"
"he asked, by what master were the two first","1.0","3.4416735172271729"
"they are by raphael,  said the senator","1.0","5.7861328125"
"i bought them at a great  price, out of vanity, some years ago","0.0","-1.7115695476531982"
"they are said to be the finest  things in italy, but they do not please me at all","1.0","2.1594417095184326"
"the colours are too  dark, the figures are not sufficiently rounded, nor in good relief  the  draperies in no way resemble stuffs","0.0","-0.042221784591674805"
"in a word, whatever may be said, i  do not find there a true imitation of nature","0.0","-0.015105009078979492"
"i only care for a picture  when i think i see nature itself  and there are none of this sort","0.0","-1.3766534328460693"
"i  have a great many pictures, but i prize them very little","0.0","-6.3079090118408203"
"while they were waiting for dinner pococurante ordered a concert","0.0","-1.6424322128295898"
"candide found the music delicious","1.0","4.0482120513916016"
"this noise,  said the senator,  may amuse one for half an hour  but if  it were to last longer it would grow tiresome to everybody, though they  durst not own it","0.0","-2.8763523101806641"
"music, to day, is only the art of executing difficult  things, and that which is only difficult cannot please long","1.0","2.539696216583252"
"perhaps i  should be fonder of the opera if they had not found the secret of making  of it a monster which shocks me","1.0","0.044218540191650391"
"let who will go to see bad tragedies  set to music, where the scenes are contrived for no other end than to  introduce two or three songs ridiculously out of place, to show off an  actress's voice","0.0","-8.4215850830078125"
"let who will, or who can, die away with pleasure at the  sight of an eunuch quavering the  r le  of c sar, or of cato, and  strutting awkwardly upon the stage","0.0","-0.84039187431335449"
"for my part i have long since  renounced those paltry entertainments which constitute the glory of  modern italy, and are purchased so dearly by sovereigns","0.0","-2.5736465454101562"
"candide disputed the point a little, but with discretion","0.0","-2.7540147304534912"
"martin was  entirely of the senator's opinion","1.0","1.6178023815155029"
"they sat down to table, and after an excellent dinner they went into the  library","0.0","-5.0537014007568359"
"candide, seeing a homer magnificently bound, commended the  virtuoso on his good taste","1.0","6.3078155517578125"
"there,  said he,  is a book that was once the delight of the great  pangloss, the best philosopher in germany","0.0","-1.4359097480773926"
"it is not mine,  answered pococurante coolly","1.0","3.4059803485870361"
"they used at one time to  make me believe that i took a pleasure in reading him","1.0","4.0742683410644531"
"but that  continual repetition of battles, so extremely like one another  those  gods that are always active without doing anything decisive  that helen  who is the cause of the war, and who yet scarcely appears in the piece   that troy, so long besieged without being taken  all these together  caused me great weariness","0.0","-3.0848031044006348"
"i have sometimes asked learned men whether  they were not as weary as i of that work","0.0","-6.4160933494567871"
"those who were sincere have  owned to me that the poem made them fall asleep  yet it was necessary to  have it in their library as a monument of antiquity, or like those rusty  medals which are no longer of use in commerce","0.0","-1.7826720476150513"
"but your excellency does not think thus of virgil?","1.0","0.81229639053344727"
"said candide","1.0","3.282764196395874"
"i grant,  said the senator,  that the second, fourth, and sixth books  of his   neid  are excellent, but as for his pious  neas, his strong  cloanthus, his friend achates, his little ascanius, his silly king  latinus, his bourgeois amata, his insipid lavinia, i think there can be  nothing more flat and disagreeable","1.0","2.7435774803161621"
"i prefer tasso a good deal, or even  the soporific tales of ariosto","1.0","1.6509630680084229"
"may i presume to ask you, sir,  said candide,  whether you do not  receive a great deal of pleasure from reading horace?","0.0","-2.7371425628662109"
"there are maxims in this writer,  answered pococurante,  from which a  man of the world may reap great benefit, and being written in energetic  verse they are more easily impressed upon the memory","1.0","3.1073760986328125"
"but i care little  for his journey to brundusium, and his account of a bad dinner, or of  his low quarrel between one rupilius whose words he says were full of  poisonous filth, and another whose language was imbued with vinegar","1.0","3.0089364051818848"
"i  have read with much distaste his indelicate verses against old women and  witches  nor do i see any merit in telling his friend m cenas that if he  will but rank him in the choir of lyric poets, his lofty head shall  touch the stars","0.0","-0.17443728446960449"
"fools admire everything in an author of reputation","1.0","2.7502400875091553"
"for  my part, i read only to please myself","1.0","5.1967954635620117"
"i like only that which serves my  purpose","0.0","-6.2651252746582031"
"candide, having been educated never to judge for himself, was much  surprised at what he heard","1.0","0.99422866106033325"
"martin found there was a good deal of reason  in pococurante's remarks","1.0","2.5357527732849121"
"oh!","0.0","-0.76267194747924805"
"here is cicero,  said candide","1.0","2.5911273956298828"
"here is the great man whom i fancy  you are never tired of reading","0.0","-0.38355493545532227"
"i never read him,  replied the venetian","1.0","1.4834215641021729"
"what is it to me whether he  pleads for rabirius or cluentius?","1.0","3.3074853420257568"
"i try causes enough myself  his  philosophical works seem to me better, but when i found that he doubted  of everything, i concluded that i knew as much as he, and that i had no  need of a guide to learn ignorance","0.0","-2.1911449432373047"
"ha!","0.0","-3.6691594123840332"
"here are four score volumes of the academy of sciences,  cried  martin","1.0","4.9074130058288574"
"perhaps there is something valuable in this collection","1.0","5.6728649139404297"
"there might be,  said pococurante,  if only one of those rakers of  rubbish had shown how to make pins  but in all these volumes there is  nothing but chimerical systems, and not a single useful thing","0.0","-3.0667197704315186"
"and what dramatic works i see here,  said candide,  in italian,  spanish, and french","0.0","-1.2065112590789795"
"yes,  replied the senator,  there are three thousand, and not three  dozen of them good for anything","0.0","-4.5385479927062988"
"as to those collections of sermons,  which altogether are not worth a single page of seneca, and those huge  volumes of theology, you may well imagine that neither i nor any one  else ever opens them","0.0","-5.6056232452392578"
"martin saw some shelves filled with english books","1.0","4.0589885711669922"
"i have a notion,  said he,  that a republican must be greatly pleased  with most of these books, which are written with a spirit of freedom","1.0","4.7718901634216309"
"yes,  answered pococurante,  it is noble to write as one thinks  this  is the privilege of humanity","0.0","-2.9311320781707764"
"in all our italy we write only what we do  not think  those who inhabit the country of the c sars and the  antoninuses dare not acquire a single idea without the permission of a  dominican friar","1.0","1.5219025611877441"
"i should be pleased with the liberty which inspires the  english genius if passion and party spirit did not corrupt all that is  estimable in this precious liberty","1.0","5.1065058708190918"
"candide, observing a milton, asked whether he did not look upon this  author as a great man","1.0","0.59775674343109131"
"who?","1.0","0.24383354187011719"
"said pococurante,  that barbarian, who writes a long commentary  in ten books of harsh verse on the first chapter of genesis  that coarse  imitator of the greeks, who disfigures the creation, and who, while  moses represents the eternal producing the world by a word, makes the  messiah take a great pair of compasses from the armoury of heaven to  circumscribe his work?","0.0","-3.0513195991516113"
"how can i have any esteem for a writer who has  spoiled tasso's hell and the devil, who transforms lucifer sometimes  into a toad and other times into a pigmy, who makes him repeat the same  things a hundred times, who makes him dispute on theology, who, by a  serious imitation of ariosto's comic invention of firearms, represents  the devils cannonading in heaven?","1.0","4.328953742980957"
"neither i nor any man in italy could  take pleasure in those melancholy extravagances  and the marriage of sin  and death, and the snakes brought forth by sin, are enough to turn the  stomach of any one with the least taste,  and his long description of a  pest house is good only for a grave digger","1.0","1.6929020881652832"
"this obscure, whimsical,  and disagreeable poem was despised upon its first publication, and i  only treat it now as it was treated in its own country by  contemporaries","0.0","-2.0825793743133545"
"for the matter of that i say what i think, and i care  very little whether others think as i do","1.0","1.0570352077484131"
"candide was grieved at this speech, for he had a respect for homer and  was fond of milton","1.0","1.6549568176269531"
"alas!","0.0","-8.5570907592773438"
"said he softly to martin,  i am afraid that this man holds our  german poets in very great contempt","0.0","-4.2515559196472168"
"there would not be much harm in that,  said martin","0.0","-7.6372671127319336"
"oh!","0.0","-0.76267194747924805"
"what a superior man,  said candide below his breath","1.0","2.6994776725769043"
"what a great  genius is this pococurante!","1.0","3.311953067779541"
"nothing can please him","0.0","-3.6241304874420166"
"after their survey of the library they went down into the garden, where  candide praised its several beauties","0.0","-3.0761518478393555"
"i know of nothing in so bad a taste,  said the master","0.0","-1.6119415760040283"
"all you see  here is merely trifling","0.0","-0.85070633888244629"
"after to morrow i will have it planted with a  nobler design","1.0","1.0894038677215576"
"well,  said candide to martin when they had taken their leave,  you  will agree that this is the happiest of mortals, for he is above  everything he possesses","0.0","-2.9656186103820801"
"but do you not see,  answered martin,  that he is disgusted with all he  possesses?","1.0","1.492117166519165"
"plato observed a long while ago that those stomachs are not  the best that reject all sorts of food","0.0","-3.2094573974609375"
"but is there not a pleasure,  said candide,  in criticising  everything, in pointing out faults where others see nothing but  beauties?","1.0","1.4173874855041504"
"that is to say,  replied martin,  that there is some pleasure in having  no pleasure","1.0","1.9857311248779297"
"well, well,  said candide,  i find that i shall be the only happy man  when i am blessed with the sight of my dear cunegonde","0.0","-3.4681124687194824"
"it is always well to hope,  said martin","1.0","1.2633318901062012"
"however, the days and the weeks passed","0.0","-5.1911249160766602"
"cacambo did not come, and  candide was so overwhelmed with grief that he did not even reflect that  paquette and friar girofl e did not return to thank him","1.0","2.0578155517578125"
"xxvi    of a supper which candide and martin took with six strangers, and who  they were","1.0","6.6360254287719727"
"34       one evening that candide and martin were going to sit down to supper  with some foreigners who lodged in the same inn, a man whose complexion  was as black as soot, came behind candide, and taking him by the arm,  said      get yourself ready to go along with us  do not fail","1.0","0.14139151573181152"
"upon this he turned round and saw  cacambo!","1.0","5.1152868270874023"
"nothing but the sight of  cunegonde could have astonished and delighted him more","0.0","-2.0981769561767578"
"he was on the  point of going mad with joy","1.0","6.532371997833252"
"he embraced his dear friend","1.0","7.6530466079711914"
"cunegonde is here, without doubt  where is she?","1.0","3.1421236991882324"
"take me to her that i  may die of joy in her company","1.0","4.8297300338745117"
"cunegonde is not here,  said cacambo,  she is at constantinople","1.0","1.7004885673522949"
"oh, heavens!","1.0","0.19499659538269043"
"at constantinople!","1.0","3.9648382663726807"
"but were she in china i would fly  thither  let us be off","1.0","3.6272697448730469"
"we shall set out after supper,  replied cacambo","0.0","-6.8167228698730469"
"i can tell you  nothing more  i am a slave, my master awaits me, i must serve him at  table  speak not a word, eat, and then get ready","1.0","1.1386111974716187"
"candide, distracted between joy and grief, delighted at seeing his  faithful agent again, astonished at finding him a slave, filled with the  fresh hope of recovering his mistress, his heart palpitating, his  understanding confused, sat down to table with martin, who saw all these  scenes quite unconcerned, and with six strangers who had come to spend  the carnival at venice","1.0","4.5345268249511719"
"cacambo waited at table upon one of the strangers  towards the end of  the entertainment he drew near his master, and whispered in his ear      sire, your majesty may start when you please, the vessel is ready","1.0","3.3042874336242676"
"on saying these words he went out","0.0","-7.303687572479248"
"the company in great surprise looked  at one another without speaking a word, when another domestic approached  his master and said to him      sire, your majesty's chaise is at padua, and the boat is ready","0.0","-6.7962369918823242"
"the master gave a nod and the servant went away","0.0","-5.581944465637207"
"the company all stared  at one another again, and their surprise redoubled","1.0","5.5847711563110352"
"a third valet came  up to a third stranger, saying      sire, believe me, your majesty ought not to stay here any longer","0.0","-0.18773031234741211"
"i am  going to get everything ready","1.0","1.3837175369262695"
"and immediately he disappeared","0.0","-8.7504339218139648"
"candide and martin did not doubt that  this was a masquerade of the carnival","0.0","-5.3606171607971191"
"then a fourth domestic said to a  fourth master      your majesty may depart when you please","0.0","-4.3162384033203125"
"saying this he went away like the rest","0.0","-9.8254413604736328"
"the fifth valet said the same  thing to the fifth master","0.0","-6.4725141525268555"
"but the sixth valet spoke differently to the  sixth stranger, who sat near candide","1.0","1.423404335975647"
"he said to him      faith, sire, they will no longer give credit to your majesty nor to me,  and we may perhaps both of us be put in jail this very night","1.0","2.6035385131835938"
"therefore  i will take care of myself","1.0","0.43162250518798828"
"adieu","0.0","-1.5365645885467529"
"the servants being all gone, the six strangers, with candide and martin,  remained in a profound silence","0.0","-2.1716947555541992"
"at length candide broke it","1.0","0.065552234649658203"
"gentlemen,  said he,  this is a very good joke indeed, but why should  you all be kings?","0.0","-1.5360944271087646"
"for me i own that neither martin nor i is a king","0.0","-3.4835987091064453"
"cacambo's master then gravely answered in italian      i am not at all joking","1.0","3.0782787799835205"
"my name is achmet iii","0.0","-5.847754955291748"
"i was grand sultan many  years","1.0","1.1432849168777466"
"i dethroned my brother  my nephew dethroned me, my viziers were  beheaded, and i am condemned to end my days in the old seraglio","1.0","5.4153037071228027"
"my  nephew, the great sultan mahmoud, permits me to travel sometimes for my  health, and i am come to spend the carnival at venice","1.0","4.3614931106567383"
"a young man who sat next to achmet, spoke then as follows      my name is ivan","0.0","-6.6540565490722656"
"i was once emperor of all the russias, but was  dethroned in my cradle","1.0","4.9004325866699219"
"my parents were confined in prison and i was  educated there  yet i am sometimes allowed to travel in company with  persons who act as guards  and i am come to spend the carnival at  venice","1.0","4.4832229614257812"
"the third said      i am charles edward, king of england  my father has resigned all his  legal rights to me","1.0","2.8443148136138916"
"i have fought in defence of them  and above eight  hundred of my adherents have been hanged, drawn, and quartered","1.0","1.4479732513427734"
"i have  been confined in prison  i am going to rome, to pay a visit to the king,  my father, who was dethroned as well as myself and my grandfather, and i  am come to spend the carnival at venice","1.0","0.10604763031005859"
"the fourth spoke thus in his turn      i am the king of poland  the fortune of war has stripped me of my  hereditary dominions  my father underwent the same vicissitudes  i  resign myself to providence in the same manner as sultan achmet, the  emperor ivan, and king charles edward, whom god long preserve  and i am  come to the carnival at venice","1.0","2.019195556640625"
"the fifth said      i am king of poland also  i have been twice dethroned  but providence  has given me another country, where i have done more good than all the  sarmatian kings were ever capable of doing on the banks of the vistula   i resign myself likewise to providence, and am come to pass the carnival  at venice","0.0","-1.1531729698181152"
"it was now the sixth monarch's turn to speak      gentlemen,  said he,  i am not so great a prince as any of you   however, i am a king","1.0","0.91052192449569702"
"i am theodore, elected king of corsica  i had the  title of majesty, and now i am scarcely treated as a gentleman","1.0","1.6757562160491943"
"i have  coined money, and now am not worth a farthing  i have had two  secretaries of state, and now i have scarce a valet  i have seen myself  on a throne, and i have seen myself upon straw in a common jail in  london","0.0","-0.93689775466918945"
"i am afraid that i shall meet with the same treatment here  though, like your majesties, i am come to see the carnival at venice","1.0","0.53926622867584229"
"the other five kings listened to this speech with generous compassion","0.0","-2.4117963314056396"
"each of them gave twenty sequins to king theodore to buy him clothes and  linen  and candide made him a present of a diamond worth two thousand  sequins","0.0","-3.0534482002258301"
"who can this private person be,  said the five kings to one another,   who is able to give, and really has given, a hundred times as much as  any of us?","0.0","-4.3482036590576172"
"just as they rose from table, in came four serene highnesses, who had  also been stripped of their territories by the fortune of war, and were  come to spend the carnival at venice","0.0","-4.7471513748168945"
"but candide paid no regard to  these newcomers, his thoughts were entirely employed on his voyage to  constantinople, in search of his beloved cunegonde","1.0","3.4385476112365723"
"xxvii    candide's voyage to constantinople","1.0","4.1972885131835938"
"the faithful cacambo had already prevailed upon the turkish skipper, who  was to conduct the sultan achmet to constantinople, to receive candide  and martin on his ship","1.0","2.5964114665985107"
"they both embarked after having made their  obeisance to his miserable highness","0.0","-0.072175502777099609"
"you see,  said candide to martin on the way,  we supped with six  dethroned kings, and of those six there was one to whom i gave charity","0.0","-1.2740297317504883"
"perhaps there are many other princes yet more unfortunate","1.0","0.82704639434814453"
"for my part,  i have only lost a hundred sheep  and now i am flying into cunegonde's  arms","1.0","2.3620979785919189"
"my dear martin, yet once more pangloss was right  all is for the  best","1.0","1.5095517635345459"
"i wish it,  answered martin","0.0","-2.2935333251953125"
"but,  said candide,  it was a very strange adventure we met with at  venice","1.0","1.1554160118103027"
"it has never before been seen or heard that six dethroned kings  have supped together at a public inn","1.0","2.6095986366271973"
"it is not more extraordinary,  said martin,  than most of the things  that have happened to us","0.0","-0.75328671932220459"
"it is a very common thing for kings to be  dethroned  and as for the honour we have had of supping in their  company, it is a trifle not worth our attention","1.0","5.696784496307373"
