"Text","Binary_Sentiment","Cont_Sentiment"
"candide having been in the bulgarian  service, performed the military exercise before the general of this  little army with so graceful an address, with so intrepid an air, and  with such agility and expedition, that he was given the command of a  company of foot","1.0","2.2514176368713379"
"now, he was a captain!","0.0","-4.2211480140686035"
"he set sail with miss cunegonde,  the old woman, two valets, and the two andalusian horses, which had  belonged to the grand inquisitor of portugal","0.0","-3.4074892997741699"
"during their voyage they reasoned a good deal on the philosophy of poor  pangloss","1.0","0.72255754470825195"
"we are going into another world,  said candide   and surely it must be  there that all is for the best","1.0","3.9738194942474365"
"for i must confess there is reason to  complain a little of what passeth in our world in regard to both  natural and moral philosophy","1.0","7.1471710205078125"
"i love you with all my heart,  said cunegonde   but my soul is still  full of fright at that which i have seen and experienced","1.0","3.5375046730041504"
"all will be well,  replied candide   the sea of this new world is  already better than our european sea  it is calmer, the winds more  regular","1.0","1.0140140056610107"
"it is certainly the new world which is the best of all possible  worlds","0.0","-5.2330865859985352"
"god grant it,  said cunegonde   but i have been so horribly unhappy  there that my heart is almost closed to hope","0.0","-0.29675388336181641"
"you complain,  said the old woman   alas!","0.0","-3.4113616943359375"
"you have not known such  misfortunes as mine","0.0","-0.19803094863891602"
"cunegonde almost broke out laughing, finding the good woman very  amusing, for pretending to have been as unfortunate as she","0.0","-0.39437770843505859"
"alas!","0.0","-8.5570907592773438"
"said cunegonde,  my good mother, unless you have been ravished  by two bulgarians, have received two deep wounds in your belly, have had  two castles demolished, have had two mothers cut to pieces before your  eyes, and two of your lovers whipped at an  auto da f  , i do not  conceive how you could be more unfortunate than i","1.0","3.7979345321655273"
"add that i was born a  baroness of seventy two quarterings  and have been a cook!","1.0","3.8265132904052734"
"miss,  replied the old woman,  you do not know my birth  and were i to  show you my backside, you would not talk in that manner, but would  suspend your judgment","1.0","4.7427740097045898"
"this speech having raised extreme curiosity in the minds of cunegonde  and candide, the old woman spoke to them as follows","1.0","8.3601703643798828"
"xi    history of the old woman","1.0","7.6041526794433594"
"i had not always bleared eyes and red eyelids  neither did my nose  always touch my chin  nor was i always a servant","0.0","-1.4349260330200195"
"i am the daughter of  pope urban x, 10  and of the princess of palestrina","1.0","1.5773615837097168"
"until the age of  fourteen i was brought up in a palace, to which all the castles of your  german barons would scarcely have served for stables  and one of my  robes was worth more than all the magnificence of westphalia","1.0","8.2806711196899414"
"as i grew  up i improved in beauty, wit, and every graceful accomplishment, in the  midst of pleasures, hopes, and respectful homage","1.0","4.665642261505127"
"already i inspired  love","0.0","-3.5565369129180908"
"my throat was formed, and such a throat!","1.0","7.1821436882019043"
"white, firm, and shaped  like that of the venus of medici  and what eyes!","1.0","4.4740395545959473"
"what eyelids!","0.0","-4.2648630142211914"
"what  black eyebrows!","0.0","-1.1262617111206055"
"such flames darted from my dark pupils that they  eclipsed the scintillation of the stars  as i was told by the poets in  our part of the world","0.0","-6.0001111030578613"
"my waiting women, when dressing and undressing  me, used to fall into an ecstasy, whether they viewed me before or  behind  how glad would the gentlemen have been to perform that office  for them!","1.0","2.8756754398345947"
"i was affianced to the most excellent prince of massa carara","1.0","1.2124136686325073"
"such a  prince!","0.0","-3.7533574104309082"
"as handsome as myself, sweet tempered, agreeable, brilliantly  witty, and sparkling with love","1.0","5.9212260246276855"
"i loved him as one loves for the first  time  with idolatry, with transport","1.0","4.3715357780456543"
"the nuptials were prepared","1.0","4.2943553924560547"
"there  was surprising pomp and magnificence  there were  f tes , carousals,  continual  opera bouffe   and all italy composed sonnets in my praise,  though not one of them was passable","1.0","0.55736804008483887"
"i was just upon the point of  reaching the summit of bliss, when an old marchioness who had been  mistress to the prince, my husband, invited him to drink chocolate with  her","0.0","-5.8903341293334961"
"he died in less than two hours of most terrible convulsions","0.0","-2.1561675071716309"
"but  this is only a bagatelle","0.0","-0.60175943374633789"
"my mother, in despair, and scarcely less  afflicted than myself, determined to absent herself for some time from  so fatal a place","1.0","0.95114731788635254"
"she had a very fine estate in the neighbourhood of  gaeta","0.0","-5.213585376739502"
"we embarked on board a galley of the country which was gilded  like the great altar of st  peter's at rome","0.0","-2.1632201671600342"
"a sallee corsair swooped  down and boarded us","1.0","7.840580940246582"
"our men defended themselves like the pope's  soldiers  they flung themselves upon their knees, and threw down their  arms, begging of the corsair an absolution  in articulo mortis","0.0","-8.7231149673461914"
"instantly they were stripped as bare as monkeys  my mother, our maids  of honour, and myself were all served in the same manner","0.0","-1.5388951301574707"
"it is amazing  with what expedition those gentry undress people","1.0","3.0665407180786133"
"but what surprised me  most was, that they thrust their fingers into the part of our bodies  which the generality of women suffer no other instrument but  pipes to  enter","1.0","1.0065450668334961"
"it appeared to me a very strange kind of ceremony  but thus one  judges of things when one has not seen the world","0.0","-6.7495136260986328"
"i afterwards learnt  that it was to try whether we had concealed any diamonds","1.0","1.5233731269836426"
"this is the  practice established from time immemorial, among civilised nations that  scour the seas","0.0","-3.9554898738861084"
"i was informed that the very religious knights of malta  never fail to make this search when they take any turkish prisoners of  either sex","0.0","-6.3573784828186035"
"it is a law of nations from which they never deviate","0.0","-2.7597055435180664"
"i need not tell  you  how great a hardship it was for a young princess  and her mother to be made slaves and carried to morocco","1.0","2.7355644702911377"
"you may easily  imagine all we had to suffer on board the pirate vessel","0.0","-1.8978323936462402"
"my mother was  still very handsome  our maids of honour, and even our waiting women,  had more charms than are to be found in all africa","1.0","2.0231533050537109"
"as for myself, i was  ravishing, was exquisite, grace itself, and i was a virgin!","1.0","2.9480929374694824"
"i did not  remain so long  this flower, which had been reserved for the handsome  prince of massa carara, was plucked by the corsair captain","0.0","-10.285726547241211"
"he was an  abominable negro, and yet believed that he did me a great deal of  honour","1.0","3.2520480155944824"
"certainly the princess of palestrina and myself must have been  very strong to go through all that we experienced until our arrival at  morocco","0.0","-3.5284690856933594"
"but let us pass on  these are such common things as not to be  worth mentioning","0.0","-3.2730672359466553"
"morocco swam in blood when we arrived","0.0","-2.8970634937286377"
"fifty sons of the emperor  muley ismael 11  had each their adherents  this produced fifty civil  wars, of blacks against blacks, and blacks against tawnies, and tawnies  against tawnies, and mulattoes against mulattoes","0.0","-2.8802974224090576"
"in short it was a  continual carnage throughout the empire","1.0","4.655951976776123"
"no sooner were we landed, than the blacks of a contrary faction to that  of my captain attempted to rob him of his booty","0.0","-4.1257419586181641"
"next to jewels and gold  we were the most valuable things he had","0.0","-0.87642192840576172"
"i was witness to such a battle  as you have never seen in your european climates","1.0","2.9152474403381348"
"the northern nations  have not that heat in their blood, nor that raging lust for women, so  common in africa","1.0","4.0213503837585449"
"it seems that you europeans have only milk in your  veins  but it is vitriol, it is fire which runs in those of the  inhabitants of mount atlas and the neighbouring countries","1.0","1.3836467266082764"
"they fought  with the fury of the lions, tigers, and serpents of the country, to see  who should have us","1.0","4.011695384979248"
"a moor seized my mother by the right arm, while my  captain's lieutenant held her by the left  a moorish soldier had hold of  her by one leg, and one of our corsairs held her by the other","0.0","-6.0473523139953613"
"thus  almost all our women were drawn in quarters by four men","1.0","1.8316346406936646"
"my captain  concealed me behind him  and with his drawn scimitar cut and slashed  every one that opposed his fury","0.0","-0.46924138069152832"
"at length i saw all our italian women,  and my mother herself, torn, mangled, massacred, by the monsters who  disputed over them","0.0","-1.1479403972625732"
"the slaves, my companions, those who had taken them,  soldiers, sailors, blacks, whites, mulattoes, and at last my captain,  all were killed, and i remained dying on a heap of dead","0.0","-1.6511225700378418"
"such scenes as  this were transacted through an extent of three hundred leagues  and yet  they never missed the five prayers a day ordained by mahomet","0.0","-7.5204977989196777"
"with difficulty i disengaged myself from such a heap of slaughtered  bodies, and crawled to a large orange tree on the bank of a neighbouring  rivulet, where i fell, oppressed with fright, fatigue, horror, despair,  and hunger","0.0","-2.0205354690551758"
"immediately after, my senses, overpowered, gave themselves  up to sleep, which was yet more swooning than repose","0.0","-7.3298811912536621"
"i was in this  state of weakness and insensibility, between life and death, when i  felt myself pressed by something that moved upon my body","1.0","3.4367258548736572"
"i opened my  eyes, and saw a white man, of good countenance, who sighed, and who said  between his teeth  ' o che sciagura d'essere senza coglioni! '  12           xii    the adventures of the old woman continued","1.0","6.4133872985839844"
"astonished and delighted to hear my native language, and no less  surprised at what this man said, i made answer that there were much  greater misfortunes than that of which he complained","1.0","4.8111052513122559"
"i told him in a  few words of the horrors which i had endured, and fainted a second time","0.0","-6.0554137229919434"
"he carried me to a neighbouring house, put me to bed, gave me food,  waited upon me, consoled me, flattered me  he told me that he had never  seen any one so beautiful as i, and that he never so much regretted the  loss of what it was impossible to recover","1.0","6.5727324485778809"
"'i was born at naples,' said he, 'there they geld two or three thousand  children every year  some die of the operation, others acquire a voice  more beautiful than that of women, and others are raised to offices of  state","0.0","-8.463531494140625"
"13  this operation was performed on me with great success and i  was chapel musician to madam, the princess of palestrina '","1.0","10.610882759094238"
"'to my mother!'","1.0","2.2808020114898682"
"cried i","0.0","-3.9824068546295166"
"'your mother!'","1.0","1.8038303852081299"
"cried he, weeping","1.0","4.8061561584472656"
"'what!","1.0","3.4181230068206787"
"can you be that young  princess whom i brought up until the age of six years, and who promised  so early to be as beautiful as you?'","1.0","3.7430896759033203"
"'it is i, indeed  but my mother lies four hundred yards hence, torn in  quarters, under a heap of dead bodies '","1.0","7.3175106048583984"
"i told him all my adventures, and he made me acquainted with his   telling me that he had been sent to the emperor of morocco by a  christian power, to conclude a treaty with that prince, in consequence  of which he was to be furnished with military stores and ships to help  to demolish the commerce of other christian governments","0.0","-6.5230007171630859"
"'my mission is done,' said this honest eunuch  'i go to embark for  ceuta, and will take you to italy","1.0","7.8637251853942871"
"ma che sciagura d'essere senza  coglioni! '     i thanked him with tears of commiseration  and instead of taking me to  italy he conducted me to algiers, where he sold me to the dey","1.0","1.6857450008392334"
"scarcely  was i sold, than the plague which had made the tour of africa, asia, and  europe, broke out with great malignancy in algiers","1.0","0.35475015640258789"
"you have seen  earthquakes  but pray, miss, have you ever had the plague?","1.0","1.3443195819854736"
"never,  answered cunegonde","1.0","4.2099242210388184"
"if you had,  said the old woman,  you would acknowledge that it is far  more terrible than an earthquake","1.0","1.5330395698547363"
"it is common in africa, and i caught  it","1.0","1.5351030826568604"
"imagine to yourself the distressed situation of the daughter of a  pope, only fifteen years old, who, in less than three months, had felt  the miseries of poverty and slavery, had been ravished almost every day,  had beheld her mother drawn in quarters, had experienced famine and war,  and was dying of the plague in algiers","0.0","-4.8360896110534668"
"i did not die, however, but my  eunuch, and the dey, and almost the whole seraglio of algiers perished","0.0","-5.2200431823730469"
"as soon as the first fury of this terrible pestilence was over, a sale  was made of the dey's slaves  i was purchased by a merchant, and carried  to tunis  this man sold me to another merchant, who sold me again to  another at tripoli  from tripoli i was sold to alexandria, from  alexandria to smyrna, and from smyrna to constantinople","1.0","0.90859967470169067"
"at length i  became the property of an aga of the janissaries, who was soon ordered  away to the defence of azof, then besieged by the russians","0.0","-3.68389892578125"
"the aga, who was a very gallant man, took his whole seraglio with him,  and lodged us in a small fort on the palus m otides, guarded by two  black eunuchs and twenty soldiers","1.0","7.1009006500244141"
"the turks killed prodigious numbers  of the russians, but the latter had their revenge","0.0","-3.4887223243713379"
"azof was destroyed by  fire, the inhabitants put to the sword, neither sex nor age was spared   until there remained only our little fort, and the enemy wanted to  starve us out","0.0","-2.569124698638916"
"the twenty janissaries had sworn they would never  surrender","0.0","-2.9446780681610107"
"the extremities of famine to which they were reduced, obliged  them to eat our two eunuchs, for fear of violating their oath","1.0","1.853290319442749"
"and at  the end of a few days they resolved also to devour the women","1.0","0.25007820129394531"
"we had a very pious and humane iman, who preached an excellent sermon,  exhorting them not to kill us all at once","0.0","-4.4600009918212891"
"'only cut off a buttock of each of those ladies,' said he, 'and you'll  fare extremely well  if you must go to it again, there will be the same  entertainment a few days hence  heaven will accept of so charitable an  action, and send you relief '","1.0","3.4135582447052002"
"he had great eloquence  he persuaded them  we underwent this terrible  operation","0.0","-7.7386989593505859"
"the iman applied the same balsam to us, as he does to  children after circumcision  and we all nearly died","1.0","2.5838348865509033"
"scarcely had the janissaries finished the repast with which we had  furnished them, than the russians came in flat bottomed boats  not a  janissary escaped","0.0","-6.1652383804321289"
"the russians paid no attention to the condition we  were in","1.0","6.0381922721862793"
"there are french surgeons in all parts of the world  one of  them who was very clever took us under his care  he cured us  and as  long as i live i shall remember that as soon as my wounds were healed he  made proposals to me","1.0","0.27558612823486328"
"he bid us all be of good cheer, telling us that  the like had happened in many sieges, and that it was according to the  laws of war","0.0","-0.18754363059997559"
"as soon as my companions could walk, they were obliged to set out for  moscow","0.0","-2.8747518062591553"
"i fell to the share of a boyard who made me his gardener, and  gave me twenty lashes a day","0.0","-1.1257162094116211"
"but this nobleman having in two years' time  been broke upon the wheel along with thirty more boyards for some broils  at court, i profited by that event  i fled","0.0","-0.11728906631469727"
"i traversed all russia  i  was a long time an inn holder's servant at riga, the same at rostock, at  vismar, at leipzig, at cassel, at utrecht, at leyden, at the hague, at  rotterdam","1.0","2.4199686050415039"
"i waxed old in misery and disgrace, having only one half of  my posteriors, and always remembering i was a pope's daughter","1.0","4.1245236396789551"
"a hundred  times i was upon the point of killing myself  but still i loved life","1.0","2.4053659439086914"
"this ridiculous foible is perhaps one of our most fatal characteristics   for is there anything more absurd than to wish to carry continually a  burden which one can always throw down?","1.0","2.3917357921600342"
"to detest existence and yet to  cling to one's existence?","1.0","4.6730861663818359"
"in brief, to caress the serpent which devours  us, till he has eaten our very heart?","1.0","4.4053201675415039"
"in the different countries which it has been my lot to traverse, and  the numerous inns where i have been servant, i have taken notice of a  vast number of people who held their own existence in abhorrence, and  yet i never knew of more than eight who voluntarily put an end to their  misery  three negroes, four englishmen, and a german professor named  robek","1.0","5.8001976013183594"
"14  i ended by being servant to the jew, don issachar, who placed  me near your presence, my fair lady","1.0","0.20377969741821289"
"i am determined to share your fate,  and have been much more affected with your misfortunes than with my own","1.0","0.5826488733291626"
"i would never even have spoken to you of my misfortunes, had you not  piqued me a little, and if it were not customary to tell stories on  board a ship in order to pass away the time","0.0","-5.6117501258850098"
"in short, miss cunegonde, i  have had experience, i know the world  therefore i advise you to divert  yourself, and prevail upon each passenger to tell his story  and if  there be one of them all, that has not cursed his life many a time, that  has not frequently looked upon himself as the unhappiest of mortals, i  give you leave to throw me headforemost into the sea","1.0","0.68919897079467773"
"xiii    how candide was forced away from his fair cunegonde and the old woman","1.0","3.8869199752807617"
"the beautiful cunegonde having heard the old woman's history, paid her  all the civilities due to a person of her rank and merit","1.0","3.9307558536529541"
"she likewise  accepted her proposal, and engaged all the passengers, one after the  other, to relate their adventures  and then both she and candide allowed  that the old woman was in the right","0.0","-2.141200065612793"
"it is a great pity,  said candide,  that the sage pangloss was hanged  contrary to custom at an  auto da f    he would tell us most amazing  things in regard to the physical and moral evils that overspread earth  and sea, and i should be able, with due respect, to make a few  objections","0.0","-0.2062801718711853"
"while each passenger was recounting his story, the ship made her way","0.0","-0.53878974914550781"
"they landed at buenos ayres","1.0","1.5357928276062012"
"cunegonde, captain candide, and the old  woman, waited on the governor, don fernando d'ibaraa, y figueora, y  mascarenes, y lampourdos, y souza","0.0","-3.7597177028656006"
"this nobleman had a stateliness  becoming a person who bore so many names","0.0","-5.784907341003418"
"he spoke to men with so noble  a disdain, carried his nose so loftily, raised his voice so  unmercifully, assumed so imperious an air, and stalked with such  intolerable pride, that those who saluted him were strongly inclined to  give him a good drubbing","0.0","-0.12862801551818848"
"cunegonde appeared to him the most beautiful  he had ever met","0.0","-3.3167862892150879"
"the first thing he did was to ask whether she was not  the captain's wife","0.0","-6.8084402084350586"
"the manner in which he asked the question alarmed  candide  he durst not say she was his wife, because indeed she was not   neither durst he say she was his sister, because it was not so  and  although this obliging lie had been formerly much in favour among the  ancients, and although it could be useful to the moderns, his soul was  too pure to betray the truth","0.0","-1.4860198497772217"
"miss cunegonde,  said he,  is to do me the honour to marry me, and we  beseech your excellency to deign to sanction our marriage","1.0","8.5520496368408203"
"don fernando d'ibaraa, y figueora, y mascarenes, y lampourdos, y souza,  turning up his moustachios, smiled mockingly, and ordered captain  candide to go and review his company","0.0","-8.5051498413085938"
"candide obeyed, and the governor  remained alone with miss cunegonde","1.0","1.1405131816864014"
"he declared his passion, protesting  he would marry her the next day in the face of the church, or otherwise,  just as should be agreeable to herself","1.0","5.8030343055725098"
"cunegonde asked a quarter of an  hour to consider of it, to consult the old woman, and to take her  resolution","0.0","-1.9059336185455322"
"the old woman spoke thus to cunegonde      miss, you have seventy two quarterings, and not a farthing  it is now  in your power to be wife to the greatest lord in south america, who has  very beautiful moustachios","1.0","4.1664800643920898"
"is it for you to pique yourself upon  inviolable fidelity?","1.0","5.5574245452880859"
"you have been ravished by bulgarians  a jew and an  inquisitor have enjoyed your favours","1.0","2.1444096565246582"
"misfortune gives sufficient  excuse","0.0","-4.9774346351623535"
"i own, that if i were in your place, i should have no scruple in  marrying the governor and in making the fortune of captain candide","0.0","-1.9142830371856689"
"while the old woman spoke with all the prudence which age and experience  gave, a small ship entered the port on board of which were an alcalde  and his alguazils, and this was what had happened","1.0","2.6477985382080078"
"as the old woman had shrewdly guessed, it was a grey friar who stole  cunegonde's money and jewels in the town of badajos, when she and  candide were escaping","1.0","1.0248019695281982"
"the friar wanted to sell some of the diamonds to  a jeweller  the jeweller knew them to be the grand inquisitor's","1.0","2.5492007732391357"
"the  friar before he was hanged confessed he had stolen them","1.0","2.8086252212524414"
"he described  the persons, and the route they had taken","0.0","-0.47182846069335938"
"the flight of cunegonde and  candide was already known","1.0","3.6519596576690674"
"they were traced to cadiz","1.0","1.6548912525177002"
"a vessel was  immediately sent in pursuit of them","0.0","-9.2486400604248047"
"the vessel was already in the port  of buenos ayres","0.0","-2.9332590103149414"
"the report spread that the alcalde was going to land,  and that he was in pursuit of the murderers of my lord the grand  inquisitor","1.0","3.4877078533172607"
"the prudent old woman saw at once what was to be done","1.0","3.0276434421539307"
"you cannot run away,  said she to cunegonde,  and you have nothing to  fear, for it was not you that killed my lord  besides the governor who  loves you will not suffer you to be ill treated  therefore stay","1.0","0.81323909759521484"
"she then ran immediately to candide","0.0","-7.7708053588867188"
"fly,  said she,  or in an hour you will be burnt","1.0","4.7436504364013672"
"there was not a moment to lose  but how could he part from cunegonde,  and where could he flee for shelter?","1.0","3.4979238510131836"
"xiv    how candide and cacambo were received by the jesuits of paraguay","1.0","7.2961263656616211"
"candide had brought such a valet with him from cadiz, as one often meets  with on the coasts of spain and in the american colonies","1.0","2.1407022476196289"
"he was a  quarter spaniard, born of a mongrel in tucuman  he had been singing boy,  sacristan, sailor, monk, pedlar, soldier, and lackey","0.0","-2.2678256034851074"
"his name was  cacambo, and he loved his master, because his master was a very good  man","0.0","-2.4936091899871826"
"he quickly saddled the two andalusian horses","0.0","-0.5406036376953125"
"come, master, let us follow the old woman's advice  let us start, and  run without looking behind us","0.0","-6.4183320999145508"
