"Text","Binary_Sentiment","Cont_Sentiment"
"candide          i    how candide was brought up in a magnificent castle, and how he was  expelled thence","1.0","5.4579286575317383"
"in a castle of westphalia, belonging to the baron of  thunder ten tronckh, lived a youth, whom nature had endowed with the  most gentle manners","1.0","0.86434650421142578"
"his countenance was a true picture of his soul","1.0","2.1538047790527344"
"he  combined a true judgment with simplicity of spirit, which was the  reason, i apprehend, of his being called candide","1.0","1.6825459003448486"
"the old servants of  the family suspected him to have been the son of the baron's sister, by  a good, honest gentleman of the neighborhood, whom that young lady would  never marry because he had been able to prove only seventy one  quarterings, the rest of his genealogical tree having been lost through  the injuries of time","1.0","0.93301904201507568"
"the baron was one of the most powerful lords in westphalia, for his  castle had not only a gate, but windows","1.0","5.4293398857116699"
"his great hall, even, was hung  with tapestry","1.0","4.8436975479125977"
"all the dogs of his farm yards formed a pack of hounds at  need  his grooms were his huntsmen  and the curate of the village was  his grand almoner","0.0","-7.1853423118591309"
"they called him  my lord,  and laughed at all his  stories","1.0","1.8458819389343262"
"the baron's lady weighed about three hundred and fifty pounds, and was  therefore a person of great consideration, and she did the honours of  the house with a dignity that commanded still greater respect","0.0","-0.63787811994552612"
"her  daughter cunegonde was seventeen years of age, fresh coloured, comely,  plump, and desirable","1.0","6.9807643890380859"
"the baron's son seemed to be in every respect  worthy of his father","1.0","7.8140511512756348"
"the preceptor pangloss 1  was the oracle of the  family, and little candide heard his lessons with all the good faith of  his age and character","1.0","7.3735342025756836"
"pangloss was professor of metaphysico theologico cosmolo nigology","1.0","3.5620980262756348"
"he  proved admirably that there is no effect without a cause, and that, in  this best of all possible worlds, the baron's castle was the most  magnificent of castles, and his lady the best of all possible  baronesses","1.0","6.2382564544677734"
"it is demonstrable,  said he,  that things cannot be otherwise than as  they are  for all being created for an end, all is necessarily for the  best end","0.0","-4.2196741104125977"
"observe, that the nose has been formed to bear  spectacles  thus we have spectacles","0.0","-5.4442787170410156"
"legs are visibly designed for  stockings  and we have stockings","0.0","-2.2219307422637939"
"stones were made to be hewn, and to  construct castles  therefore my lord has a magnificent castle  for the  greatest baron in the province ought to be the best lodged","0.0","-1.4228124618530273"
"pigs were  made to be eaten  therefore we eat pork all the year round","0.0","-3.0390365123748779"
"consequently  they who assert that all is well have said a foolish thing, they should  have said all is for the best","1.0","0.80862051248550415"
"candide listened attentively and believed innocently  for he thought  miss cunegonde extremely beautiful, though he never had the courage to  tell her so","1.0","3.6797659397125244"
"he concluded that after the happiness of being born of  baron of thunder ten tronckh, the second degree of happiness was to be  miss cunegonde, the third that of seeing her every day, and the fourth  that of hearing master pangloss, the greatest philosopher of the whole  province, and consequently of the whole world","0.0","-0.11705964803695679"
"one day cunegonde, while walking near the castle, in a little wood which  they called a park, saw between the bushes, dr  pangloss giving a lesson  in experimental natural philosophy to her mother's chamber maid, a  little brown wench, very pretty and very docile","1.0","1.8260478973388672"
"as miss cunegonde had a  great disposition for the sciences, she breathlessly observed the  repeated experiments of which she was a witness  she clearly perceived  the force of the doctor's reasons, the effects, and the causes  she  turned back greatly flurried, quite pensive, and filled with the desire  to be learned  dreaming that she might well be a  sufficient reason  for  young candide, and he for her","1.0","3.5346364974975586"
"she met candide on reaching the castle and blushed  candide blushed  also  she wished him good morrow in a faltering tone, and candide spoke  to her without knowing what he said","1.0","2.1672177314758301"
"the next day after dinner, as they  went from table, cunegonde and candide found themselves behind a screen   cunegonde let fall her handkerchief, candide picked it up, she took him  innocently by the hand, the youth as innocently kissed the young lady's  hand with particular vivacity, sensibility, and grace  their lips met,  their eyes sparkled, their knees trembled, their hands strayed","0.0","-10.533993721008301"
"baron  thunder ten tronckh passed near the screen and beholding this cause and  effect chased candide from the castle with great kicks on the backside   cunegonde fainted away  she was boxed on the ears by the baroness, as  soon as she came to herself  and all was consternation in this most  magnificent and most agreeable of all possible castles","1.0","0.84953266382217407"
"ii    what became of candide among the bulgarians","1.0","2.647252082824707"
"candide, driven from terrestrial paradise, walked a long while without  knowing where, weeping, raising his eyes to heaven, turning them often  towards the most magnificent of castles which imprisoned the purest of  noble young ladies","1.0","7.1604862213134766"
"he lay down to sleep without supper, in the middle  of a field between two furrows","1.0","6.5921535491943359"
"the snow fell in large flakes","0.0","-0.76610535383224487"
"next day  candide, all benumbed, dragged himself towards the neighbouring town  which was called waldberghofftrarbk dikdorff, having no money, dying of  hunger and fatigue, he stopped sorrowfully at the door of an inn","0.0","-1.0641229152679443"
"two  men dressed in blue observed him","0.0","-4.0364770889282227"
"comrade,  said one,  here is a well built young fellow, and of proper  height","1.0","2.1890361309051514"
"they went up to candide and very civilly invited him to dinner","0.0","-3.0386018753051758"
"gentlemen,  replied candide, with a most engaging modesty,  you do me  great honour, but i have not wherewithal to pay my share","1.0","3.4014065265655518"
"oh, sir,  said one of the blues to him,  people of your appearance and  of your merit never pay anything  are you not five feet five inches  high?","0.0","-6.4020833969116211"
"yes, sir, that is my height,  answered he, making a low bow","0.0","-5.2930617332458496"
"come, sir, seat yourself  not only will we pay your reckoning, but we  will never suffer such a man as you to want money  men are only born to  assist one another","0.0","-7.1781902313232422"
"you are right,  said candide   this is what i was always taught by mr   pangloss, and i see plainly that all is for the best","1.0","4.5272717475891113"
"they begged of him to accept a few crowns","1.0","3.5501785278320312"
"he took them, and wished to  give them his note  they refused  they seated themselves at table","0.0","-2.0072522163391113"
"love you not deeply?","0.0","-0.50133818387985229"
"oh yes,  answered he   i deeply love miss cunegonde","1.0","1.4741637706756592"
"no,  said one of the gentlemen,  we ask you if you do not deeply love  the king of the bulgarians?","0.0","-5.05364990234375"
"not at all,  said he   for i have never seen him","0.0","-4.1081948280334473"
"what!","1.0","3.4411015510559082"
"he is the best of kings, and we must drink his health","1.0","7.6093902587890625"
"oh!","0.0","-0.76267194747924805"
"very willingly, gentlemen,  and he drank","1.0","7.0000371932983398"
"that is enough,  they tell him","0.0","-3.2093062400817871"
"now you are the help, the support,  the defender, the hero of the bulgarians","0.0","-0.24489784240722656"
"your fortune is made, and your  glory is assured","0.0","-2.3537037372589111"
"instantly they fettered him, and carried him away to the regiment","1.0","3.547640323638916"
"there  he was made to wheel about to the right, and to the left, to draw his  rammer, to return his rammer, to present, to fire, to march, and they  gave him thirty blows with a cudgel","0.0","-3.7594077587127686"
"the next day he did his exercise a  little less badly, and he received but twenty blows","0.0","-8.891261100769043"
"the day following  they gave him only ten, and he was regarded by his comrades as a  prodigy","0.0","-4.8554787635803223"
"candide, all stupefied, could not yet very well realise how he was a  hero","1.0","2.0080771446228027"
"he resolved one fine day in spring to go for a walk, marching  straight before him, believing that it was a privilege of the human as  well as of the animal species to make use of their legs as they pleased","1.0","6.0410184860229492"
"he had advanced two leagues when he was overtaken by four others, heroes  of six feet, who bound him and carried him to a dungeon","0.0","-6.4730978012084961"
"he was asked  which he would like the best, to be whipped six and thirty times through  all the regiment, or to receive at once twelve balls of lead in his  brain","1.0","0.13076972961425781"
"he vainly said that human will is free, and that he chose neither  the one nor the other","0.0","-6.5990710258483887"
"he was forced to make a choice  he determined, in  virtue of that gift of god called liberty, to run the gauntlet  six and thirty times","1.0","5.2842555046081543"
"he bore this twice","0.0","-6.2193622589111328"
"the regiment was composed of  two thousand men  that composed for him four thousand strokes, which  laid bare all his muscles and nerves, from the nape of his neck quite  down to his rump","1.0","1.4954779148101807"
"as they were going to proceed to a third whipping,  candide, able to bear no more, begged as a favour that they would be so  good as to shoot him","1.0","1.4507138729095459"
"he obtained this favour  they bandaged his eyes,  and bade him kneel down","1.0","7.0236120223999023"
"the king of the bulgarians passed at this  moment and ascertained the nature of the crime","1.0","1.8306592702865601"
"as he had great talent,  he understood from all that he learnt of candide that he was a young  metaphysician, extremely ignorant of the things of this world, and he  accorded him his pardon with a clemency which will bring him praise in  all the journals, and throughout all ages","0.0","-6.448209285736084"
"an able surgeon cured candide in three weeks by means of emollients  taught by dioscorides","0.0","-2.0623271465301514"
"he had already a little skin, and was able to  march when the king of the bulgarians gave battle to the king of the  abares","0.0","-2.6147799491882324"
"2           iii    how candide made his escape from the bulgarians, and what afterwards  became of him","1.0","2.128345251083374"
"there was never anything so gallant, so spruce, so brilliant, and so  well disposed as the two armies","1.0","3.5103561878204346"
"trumpets, fifes, hautboys, drums, and  cannon made music such as hell itself had never heard","0.0","-0.7655947208404541"
"the cannons first  of all laid flat about six thousand men on each side  the muskets swept  away from this best of worlds nine or ten thousand ruffians who infested  its surface","0.0","-1.4903120994567871"
"the bayonet was also a  sufficient reason  for the death of  several thousands","0.0","-0.035805940628051758"
"the whole might amount to thirty thousand souls","0.0","-8.2653064727783203"
"candide, who trembled like a philosopher, hid himself as well as he  could during this heroic butchery","1.0","3.1755571365356445"
"at length, while the two kings were causing te deum to be sung each in  his own camp, candide resolved to go and reason elsewhere on effects and  causes","0.0","-4.1247787475585938"
"he passed over heaps of dead and dying, and first reached a  neighbouring village  it was in cinders, it was an abare village which  the bulgarians had burnt according to the laws of war","1.0","3.2672553062438965"
"here, old men  covered with wounds, beheld their wives, hugging their children to their  bloody breasts, massacred before their faces  there, their daughters,  disembowelled and breathing their last after having satisfied the  natural wants of bulgarian heroes  while others, half burnt in the  flames, begged to be despatched","0.0","-4.6272892951965332"
"the earth was strewed with brains,  arms, and legs","0.0","-8.0449810028076172"
"candide fled quickly to another village  it belonged to the bulgarians   and the abarian heroes had treated it in the same way","1.0","0.19895243644714355"
"candide, walking  always over palpitating limbs or across ruins, arrived at last beyond  the seat of war, with a few provisions in his knapsack, and miss  cunegonde always in his heart","1.0","1.1507797241210938"
"his provisions failed him when he arrived  in holland  but having heard that everybody was rich in that country,  and that they were christians, he did not doubt but he should meet with  the same treatment from them as he had met with in the baron's castle,  before miss cunegonde's bright eyes were the cause of his expulsion  thence","0.0","-0.5477442741394043"
"he asked alms of several grave looking people, who all answered him,  that if he continued to follow this trade they would confine him to the  house of correction, where he should be taught to get a living","0.0","-3.1993033885955811"
"the next he addressed was a man who had been haranguing a large assembly  for a whole hour on the subject of charity","0.0","-10.67682933807373"
"but the orator, looking  askew, said      what are you doing here?","0.0","-2.0430707931518555"
"are you for the good cause?","1.0","3.1697330474853516"
"there can be no effect without a cause,  modestly answered candide    the whole is necessarily concatenated and arranged for the best","1.0","0.3233342170715332"
"it was  necessary for me to have been banished from the presence of miss  cunegonde, to have afterwards run the gauntlet, and now it is necessary  i should beg my bread until i learn to earn it  all this cannot be  otherwise","0.0","-6.6906118392944336"
"my friend,  said the orator to him,  do you believe the pope to be  anti christ?","0.0","-5.7316994667053223"
"i have not heard it,  answered candide   but whether he be, or whether  he be not, i want bread","0.0","-0.60924243927001953"
"thou dost not deserve to eat,  said the other","0.0","-4.2514257431030273"
"begone, rogue  begone,  wretch  do not come near me again","1.0","0.011967658996582031"
"the orator's wife, putting her head out of the window, and spying a man  that doubted whether the pope was anti christ, poured over him a  full     oh, heavens!","1.0","1.8865010738372803"
"to what excess does religious zeal carry the  ladies","0.0","-0.68718552589416504"
"a man who had never been christened, a good anabaptist, named james,  beheld the cruel and ignominious treatment shown to one of his  brethren, an unfeathered biped with a rational soul, he took him home,  cleaned him, gave him bread and beer, presented him with two florins,  and even wished to teach him the manufacture of persian stuffs which  they make in holland","0.0","-4.7864933013916016"
"candide, almost prostrating himself before him,  cried      master pangloss has well said that all is for the best in this world,  for i am infinitely more touched by your extreme generosity than with  the inhumanity of that gentleman in the black coat and his lady","1.0","2.91249680519104"
"the next day, as he took a walk, he met a beggar all covered with scabs,  his eyes diseased, the end of his nose eaten away, his mouth distorted,  his teeth black, choking in his throat, tormented with a violent cough,  and spitting out a tooth at each effort","0.0","-8.5032978057861328"
"iv    how candide found his old master pangloss, and what happened to them","1.0","2.0425357818603516"
"candide, yet more moved with compassion than with horror, gave to this  shocking beggar the two florins which he had received from the honest  anabaptist james","0.0","-1.4458932876586914"
"the spectre looked at him very earnestly, dropped a  few tears, and fell upon his neck","0.0","-3.9711089134216309"
"candide recoiled in disgust","1.0","4.334320068359375"
"alas!","0.0","-8.5570907592773438"
"said one wretch to the other,  do you no longer know your dear  pangloss?","0.0","-0.61474347114562988"
"what do i hear?","1.0","1.8199527263641357"
"you, my dear master!","1.0","1.3797039985656738"
"you in this terrible plight!","1.0","1.8457040786743164"
"what  misfortune has happened to you?","0.0","-0.9214320182800293"
"why are you no longer in the most  magnificent of castles?","0.0","-1.9126138687133789"
"what has become of miss cunegonde, the pearl of  girls, and nature's masterpiece?","1.0","2.9027280807495117"
"i am so weak that i cannot stand,  said pangloss","1.0","1.4764186143875122"
"upon which candide carried him to the anabaptist's stable, and gave him  a crust of bread","1.0","1.6108355522155762"
"as soon as pangloss had refreshed himself a little      well,  said candide,  cunegonde?","0.0","-1.0832836627960205"
"she is dead,  replied the other","0.0","-3.2412278652191162"
"candide fainted at this word  his friend recalled his senses with a  little bad vinegar which he found by chance in the stable","0.0","-3.3732302188873291"
"candide  reopened his eyes","1.0","7.1918830871582031"
"cunegonde is dead!","1.0","3.8325955867767334"
"ah, best of worlds, where art thou?","0.0","-2.058351993560791"
"but of what  illness did she die?","1.0","2.5057234764099121"
"was it not for grief, upon seeing her father kick  me out of his magnificent castle?","1.0","1.9814367294311523"
"no,  said pangloss,  she was ripped open by the bulgarian soldiers,  after having been violated by many  they broke the baron's head for  attempting to defend her  my lady, her mother, was cut in pieces  my  poor pupil was served just in the same manner as his sister  and as for  the castle, they have not left one stone upon another, not a barn, nor a  sheep, nor a duck, nor a tree  but we have had our revenge, for the  abares have done the very same thing to a neighbouring barony, which  belonged to a bulgarian lord","0.0","-4.206580638885498"
"at this discourse candide fainted again  but coming to himself, and  having said all that it became him to say, inquired into the cause and  effect, as well as into the  sufficient reason  that had reduced  pangloss to so miserable a plight","0.0","-0.70692968368530273"
"alas!","0.0","-8.5570907592773438"
"said the other,  it was love  love, the comfort of the human  species, the preserver of the universe, the soul of all sensible beings,  love, tender love","0.0","-1.6902763843536377"
"alas!","0.0","-8.5570907592773438"
"said candide,  i know this love, that sovereign of hearts, that  soul of our souls  yet it never cost me more than a kiss and twenty  kicks on the backside","1.0","4.2809910774230957"
"how could this beautiful cause produce in you an  effect so abominable?","1.0","1.5206727981567383"
"pangloss made answer in these terms   oh, my dear candide, you remember  paquette, that pretty wench who waited on our noble baroness  in her  arms i tasted the delights of paradise, which produced in me those hell  torments with which you see me devoured  she was infected with them, she  is perhaps dead of them","1.0","4.004828929901123"
"this present paquette received of a learned  grey friar, who had traced it to its source  he had had it of an old  countess, who had received it from a cavalry captain, who owed it to a  marchioness, who took it from a page, who had received it from a jesuit,  who when a novice had it in a direct line from one of the companions of  christopher columbus","0.0","-3.8607368469238281"
"3  for my part i shall give it to nobody, i am  dying","1.0","1.2460544109344482"
"oh, pangloss!","1.0","0.19499659538269043"
"cried candide,  what a strange genealogy!","0.0","-2.451530933380127"
"is not the  devil the original stock of it?","0.0","-0.39899015426635742"
"not at all,  replied this great man,  it was a thing unavoidable, a  necessary ingredient in the best of worlds  for if columbus had not in  an island of america caught this disease, which contaminates the source  of life, frequently even hinders generation, and which is evidently  opposed to the great end of nature, we should have neither chocolate nor  cochineal","0.0","-3.2386877536773682"
"we are also to observe that upon our continent, this  distemper is like religious controversy, confined to a particular spot","0.0","-0.41917538642883301"
"the turks, the indians, the persians, the chinese, the siamese, the  japanese, know nothing of it  but there is a sufficient reason for  believing that they will know it in their turn in a few centuries","0.0","-4.7126154899597168"
"in  the meantime, it has made marvellous progress among us, especially in  those great armies composed of honest well disciplined hirelings, who  decide the destiny of states  for we may safely affirm that when an army  of thirty thousand men fights another of an equal number, there are  about twenty thousand of them p x d on each side","0.0","-0.46446013450622559"
"well, this is wonderful!","1.0","3.1831803321838379"
"said candide,  but you must get cured","1.0","4.4845361709594727"
"alas!","0.0","-8.5570907592773438"
"how can i?","1.0","3.5527405738830566"
"said pangloss,  i have not a farthing, my friend, and  all over the globe there is no letting of blood or taking a glister,  without paying, or somebody paying for you","0.0","-0.20238649845123291"
"these last words determined candide  he went and flung himself at the  feet of the charitable anabaptist james, and gave him so touching a  picture of the state to which his friend was reduced, that the good man  did not scruple to take dr  pangloss into his house, and had him cured  at his expense","0.0","-7.4751482009887695"
"in the cure pangloss lost only an eye and an ear","0.0","-3.7387180328369141"
"he  wrote well, and knew arithmetic perfectly","1.0","1.8273353576660156"
"the anabaptist james made him  his bookkeeper","1.0","0.72990894317626953"
"at the end of two months, being obliged to go to lisbon  about some mercantile affairs, he took the two philosophers with him in  his ship","0.0","-4.6385078430175781"
"pangloss explained to him how everything was so constituted  that it could not be better","0.0","-0.94324624538421631"
"james was not of this opinion","0.0","-0.67533159255981445"
"it is more likely,  said he,  mankind have a little corrupted nature,  for they were not born wolves, and they have become wolves  god has  given them neither cannon of four and twenty pounders, nor bayonets  and  yet they have made cannon and bayonets to destroy one another","0.0","-4.1933860778808594"
"into this  account i might throw not only bankrupts, but justice which seizes on  the effects of bankrupts to cheat the creditors","1.0","0.46440362930297852"
"all this was indispensable,  replied the one eyed doctor,  for private  misfortunes make the general good, so that the more private misfortunes  there are the greater is the general good","1.0","4.4556217193603516"
"while he reasoned, the sky darkened, the winds blew from the four  quarters, and the ship was assailed by a most terrible tempest within  sight of the port of lisbon","0.0","-1.7785439491271973"
"v    tempest, shipwreck, earthquake, and what became of doctor pangloss,  candide, and james the anabaptist","1.0","5.1634950637817383"
"half dead of that inconceivable anguish which the rolling of a ship  produces, one half of the passengers were not even sensible of the  danger","0.0","-5.6330132484436035"
"the other half shrieked and prayed","1.0","1.0977628231048584"
"the sheets were rent, the  masts broken, the vessel gaped","0.0","-4.5370678901672363"
"work who would, no one heard, no one  commanded","0.0","-3.3196871280670166"
"the anabaptist being upon deck bore a hand  when a brutish  sailor struck him roughly and laid him sprawling  but with the violence  of the blow he himself tumbled head foremost overboard, and stuck upon a  piece of the broken mast","0.0","-4.5212063789367676"
"honest james ran to his assistance, hauled him  up, and from the effort he made was precipitated into the sea in sight  of the sailor, who left him to perish, without deigning to look at him","0.0","-0.13333010673522949"
"candide drew near and saw his benefactor, who rose above the water one  moment and was then swallowed up for ever","1.0","1.5324234962463379"
"he was just going to jump  after him, but was prevented by the philosopher pangloss, who  demonstrated to him that the bay of lisbon had been made on purpose for  the anabaptist to be drowned","0.0","-3.7639997005462646"
"while he was proving this    priori , the  ship foundered  all perished except pangloss, candide, and that brutal  sailor who had drowned the good anabaptist","0.0","-2.0287463665008545"
"the villain swam safely to  the shore, while pangloss and candide were borne thither upon a plank","1.0","3.6772966384887695"
"as soon as they recovered themselves a little they walked toward lisbon","0.0","-2.1742751598358154"
"they had some money left, with which they hoped to save themselves from  starving, after they had escaped drowning","0.0","-5.9126377105712891"
