"Text","Binary_Sentiment","Cont_Sentiment"
"the last night she  played  the night you saw her  she acted badly because she had known  the reality of love","0.0","-5.5463647842407227"
"when she knew its unreality, she died, as juliet  might have died","0.0","-4.4192914962768555"
"she passed again into the sphere of art","1.0","1.117788553237915"
"there is  something of the martyr about her","1.0","3.365635871887207"
"her death has all the pathetic  uselessness of martyrdom, all its wasted beauty","0.0","-0.64103639125823975"
"but, as i was saying,  you must not think i have not suffered","1.0","0.043924994766712189"
"if you had come in yesterday  at a particular moment  about half past five, perhaps, or a quarter to  six  you would have found me in tears","0.0","-6.4265251159667969"
"even harry, who was here, who  brought me the news, in fact, had no idea what i was going through","0.0","-4.0235824584960938"
"i  suffered immensely","1.0","2.8847036361694336"
"then it passed away","0.0","-1.8736416101455688"
"i cannot repeat an emotion","1.0","1.5955958366394043"
"no one can, except sentimentalists","0.0","-1.2974882125854492"
"and you are awfully unjust, basil","0.0","-0.68360471725463867"
"you come down here to console me","0.0","-1.8513917922973633"
"that is charming of you","1.0","4.1799893379211426"
"you find  me consoled, and you are furious","1.0","3.3704924583435059"
"how like a sympathetic person!","1.0","3.362945556640625"
"you  remind me of a story harry told me about a certain philanthropist who  spent twenty years of his life in trying to get some grievance  redressed, or some unjust law altered  i forget exactly what it was","1.0","1.1445921659469604"
"finally he succeeded, and nothing could exceed his disappointment","0.0","-8.266815185546875"
"he  had absolutely nothing to do, almost died of  ennui , and became a  confirmed misanthrope","0.0","-2.456305980682373"
"and besides, my dear old basil, if you really  want to console me, teach me rather to forget what has happened, or to  see it from a proper artistic point of view","0.0","-0.49714332818984985"
"was it not gautier who  used to write about  la consolation des arts ?","0.0","-4.592193603515625"
"i remember picking up a  little vellum covered book in your studio one day and chancing on that  delightful phrase","1.0","0.47912114858627319"
"well, i am not like that young man you told me of  when we were down at marlow together, the young man who used to say  that yellow satin could console one for all the miseries of life","1.0","0.96319925785064697"
"i  love beautiful things that one can touch and handle","1.0","2.076723575592041"
"old brocades,  green bronzes, lacquer work, carved ivories, exquisite surroundings,  luxury, pomp  there is much to be got from all these","0.0","-0.52283239364624023"
"but the artistic  temperament that they create, or at any rate reveal, is still more to  me","1.0","2.0817656517028809"
"to become the spectator of one's own life, as harry says, is to  escape the suffering of life","1.0","2.8864898681640625"
"i know you are surprised at my talking  to you like this","1.0","2.355013370513916"
"you have not realized how i have developed","0.0","-5.5333690643310547"
"i was a  schoolboy when you knew me","0.0","-2.3372068405151367"
"i am a man now","1.0","2.8916046619415283"
"i have new passions, new  thoughts, new ideas","1.0","5.4913749694824219"
"i am different, but you must not like me less","1.0","1.423792839050293"
"i  am changed, but you must always be my friend","1.0","1.5783843994140625"
"of course, i am very  fond of harry","0.0","-0.71173608303070068"
"but i know that you are better than he is","1.0","0.64133667945861816"
"you are not  stronger  you are too much afraid of life  but you are better","0.0","-1.1786342859268188"
"and how  happy we used to be together!","1.0","3.0188226699829102"
"don't leave me, basil, and don't quarrel  with me","0.0","-0.40212935209274292"
"i am what i am","1.0","3.9956974983215332"
"there is nothing more to be said","0.0","-3.0584492683410645"
"the painter felt strangely moved","1.0","7.173675537109375"
"the lad was infinitely dear to him,  and his personality had been the great turning point in his art","0.0","-2.1815023422241211"
"he  could not bear the idea of reproaching him any more","0.0","-5.3021535873413086"
"after all, his  indifference was probably merely a mood that would pass away","0.0","-5.261751651763916"
"there  was so much in him that was good, so much in him that was noble","0.0","-3.6231784820556641"
"well, dorian,  he said at length, with a sad smile,  i won't speak to  you again about this horrible thing, after to day","0.0","-2.055128812789917"
"i only trust your  name won't be mentioned in connection with it","0.0","-1.9932231903076172"
"the inquest is to take  place this afternoon","1.0","0.72345912456512451"
"have they summoned you?","0.0","-0.90596258640289307"
"dorian shook his head, and a look of annoyance passed over his face at  the mention of the word  inquest","0.0","-0.27474063634872437"
"there was something so crude and  vulgar about everything of the kind","0.0","-6.3050727844238281"
"they don't know my name,  he  answered","0.0","-2.824103832244873"
"but surely she did?","0.0","-2.8290293216705322"
"only my christian name, and that i am quite sure she never mentioned  to any one","1.0","0.86983627080917358"
"she told me once that they were all rather curious to  learn who i was, and that she invariably told them my name was prince  charming","0.0","-3.9707851409912109"
"it was pretty of her","0.0","-1.1742236614227295"
"you must do me a drawing of sibyl,  basil","1.0","3.4323985576629639"
"i should like to have something more of her than the memory of  a few kisses and some broken pathetic words","0.0","-2.9378445148468018"
"i will try and do something, dorian, if it would please you","1.0","0.80056345462799072"
"but you  must come and sit to me yourself again","0.0","-0.2606695294380188"
"i can't get on without you","0.0","-2.6026356220245361"
"i can never sit to you again, basil","1.0","1.4107600450515747"
"it is impossible!","1.0","2.3054862022399902"
"he exclaimed,  starting back","1.0","4.4058442115783691"
"the painter stared at him","0.0","-0.096353039145469666"
"my dear boy, what nonsense!","1.0","1.92402184009552"
"he cried","0.0","-0.47140657901763916"
"do you mean to say you don't like what i did of you?","0.0","-0.97723513841629028"
"where is it?","0.0","-2.193608283996582"
"why have you pulled the screen in front of it?","0.0","-0.76300406455993652"
"let me look at it","0.0","-0.30952939391136169"
"it  is the best thing i have ever done","1.0","0.25932988524436951"
"do take the screen away, dorian","0.0","-0.7853512167930603"
"it is simply disgraceful of your servant hiding my work like that","0.0","-0.87607300281524658"
"i  felt the room looked different as i came in","0.0","-4.0613312721252441"
"my servant has nothing to do with it, basil","1.0","0.5420076847076416"
"you don't imagine i let  him arrange my room for me?","0.0","-5.0587882995605469"
"he settles my flowers for me  sometimes  that is all","0.0","-4.5781087875366211"
"no  i did it myself","0.0","-0.93992257118225098"
"the light was too strong  on the portrait","0.0","-2.2152271270751953"
"too strong!","0.0","-0.015060946345329285"
"surely not, my dear fellow?","0.0","-1.4114507436752319"
"it is an admirable place for  it","1.0","3.1047616004943848"
"let me see it","0.0","-1.0392003059387207"
"and hallward walked towards the corner of the  room","0.0","-1.926770806312561"
"a cry of terror broke from dorian gray's lips, and he rushed between  the painter and the screen","1.0","1.2172489166259766"
"basil,  he said, looking very pale,  you  must not look at it","1.0","0.83539128303527832"
"i don't wish you to","0.0","-0.19814562797546387"
"not look at my own work!","1.0","1.732459545135498"
"you are not serious","0.0","-0.6442907452583313"
"why shouldn't i look  at it?","0.0","-1.2685074806213379"
"exclaimed hallward, laughing","1.0","0.096469327807426453"
"if you try to look at it, basil, on my word of honour i will never  speak to you again as long as i live","1.0","0.88613402843475342"
"i am quite serious","1.0","1.1196675300598145"
"i don't  offer any explanation, and you are not to ask for any","1.0","0.89848577976226807"
"but, remember,  if you touch this screen, everything is over between us","1.0","0.44702035188674927"
"hallward was thunderstruck","0.0","-0.92180043458938599"
"he looked at dorian gray in absolute  amazement","0.0","-3.2108402252197266"
"he had never seen him like this before","0.0","-2.8692021369934082"
"the lad was  actually pallid with rage","1.0","0.6794126033782959"
"his hands were clenched, and the pupils of  his eyes were like disks of blue fire","0.0","-0.71116733551025391"
"he was trembling all over","0.0","-0.91912174224853516"
"dorian!","1.0","0.54658794403076172"
"don't speak!","0.0","-2.1428031921386719"
"but what is the matter?","0.0","-0.79765689373016357"
"of course i won't look at it if you don't  want me to,  he said, rather coldly, turning on his heel and going over  towards the window","0.0","-0.10587213933467865"
"but, really, it seems rather absurd that i  shouldn't see my own work, especially as i am going to exhibit it in  paris in the autumn","1.0","0.88296711444854736"
"i shall probably have to give it another coat of  varnish before that, so i must see it some day, and why not to day?","0.0","-4.050468921661377"
"to exhibit it!","1.0","0.76476669311523438"
"you want to exhibit it?","0.0","-1.51883864402771"
"exclaimed dorian gray, a  strange sense of terror creeping over him","1.0","5.7546539306640625"
"was the world going to be  shown his secret?","0.0","-7.1249160766601562"
"were people to gape at the mystery of his life?","0.0","-1.1594994068145752"
"that was impossible","0.0","-0.76397788524627686"
"something  he did not know what  had to be done  at once","0.0","-2.1526141166687012"
"yes  i don't suppose you will object to that","0.0","-7.1008939743041992"
"georges petit is going  to collect all my best pictures for a special exhibition in the rue de  seze, which will open the first week in october","1.0","2.5121474266052246"
"the portrait will  only be away a month","0.0","-1.5593661069869995"
"i should think you could easily spare it for  that time","1.0","6.6402149200439453"
"in fact, you are sure to be out of town","1.0","1.496999979019165"
"and if you keep  it always behind a screen, you can't care much about it","1.0","1.5105071067810059"
"dorian gray passed his hand over his forehead","0.0","-3.1757493019104004"
"there were beads of  perspiration there","0.0","-1.3136508464813232"
"he felt that he was on the brink of a horrible  danger","0.0","-0.54390788078308105"
"you told me a month ago that you would never exhibit it,  he  cried","1.0","0.73714190721511841"
"why have you changed your mind?","0.0","-4.6547880172729492"
"you people who go in for  being consistent have just as many moods as others have","0.0","-1.5685551166534424"
"the only  difference is that your moods are rather meaningless","0.0","-2.842543363571167"
"you can't have  forgotten that you assured me most solemnly that nothing in the world  would induce you to send it to any exhibition","1.0","2.5015192031860352"
"you told harry exactly  the same thing","0.0","-2.4413242340087891"
"he stopped suddenly, and a gleam of light came into  his eyes","1.0","0.017049141228199005"
"he remembered that lord henry had said to him once, half  seriously and half in jest,  if you want to have a strange quarter of  an hour, get basil to tell you why he won't exhibit your picture","0.0","-2.9557688236236572"
"he  told me why he wouldn't, and it was a revelation to me","0.0","-3.4701619148254395"
"yes, perhaps  basil, too, had his secret","0.0","-2.8174901008605957"
"he would ask him and try","0.0","-0.45598286390304565"
"basil,  he said, coming over quite close and looking him straight in  the face,  we have each of us a secret","0.0","-0.34725302457809448"
"let me know yours, and i shall  tell you mine","0.0","-3.7987911701202393"
"what was your reason for refusing to exhibit my  picture?","0.0","-0.16780707240104675"
"the painter shuddered in spite of himself","1.0","2.5455317497253418"
"dorian, if i told you, you  might like me less than you do, and you would certainly laugh at me","0.0","-1.0040950775146484"
"i  could not bear your doing either of those two things","0.0","-1.7879273891448975"
"if you wish me  never to look at your picture again, i am content","1.0","1.3819453716278076"
"i have always you  to look at","1.0","4.6429228782653809"
"if you wish the best work i have ever done to be hidden  from the world, i am satisfied","1.0","3.9420881271362305"
"your friendship is dearer to me than  any fame or reputation","0.0","-2.5068135261535645"
"no, basil, you must tell me,  insisted dorian gray","1.0","1.8516339063644409"
"i think i have a  right to know","1.0","0.54963064193725586"
"his feeling of terror had passed away, and curiosity  had taken its place","0.0","-2.1642584800720215"
"he was determined to find out basil hallward's  mystery","0.0","-1.9988338947296143"
"let us sit down, dorian,  said the painter, looking troubled","0.0","-1.3432599306106567"
"let us  sit down","0.0","-2.5384173393249512"
"and just answer me one question","0.0","-5.416938304901123"
"have you noticed in the  picture something curious?  something that probably at first did not  strike you, but that revealed itself to you suddenly?","1.0","0.17879991233348846"
"basil!","1.0","0.54658794403076172"
"cried the lad, clutching the arms of his chair with trembling  hands and gazing at him with wild startled eyes","1.0","2.2276134490966797"
"i see you did","1.0","1.45176100730896"
"don't speak","0.0","-2.8582737445831299"
"wait till you hear what i have to say","1.0","0.14973877370357513"
"dorian, from the moment i met you, your personality had the most  extraordinary influence over me","1.0","0.79492771625518799"
"i was dominated, soul, brain, and  power, by you","1.0","1.8048965930938721"
"you became to me the visible incarnation of that unseen  ideal whose memory haunts us artists like an exquisite dream","1.0","4.0378117561340332"
"i  worshipped you","1.0","0.8740496039390564"
"i grew jealous of every one to whom you spoke","0.0","-1.8245508670806885"
"i  wanted to have you all to myself","1.0","0.20754392445087433"
"i was only happy when i was with  you","1.0","0.12517334520816803"
"when you were away from me, you were still present in my art      of course, i never let you know anything about this","1.0","1.0705389976501465"
"it would have  been impossible","0.0","-1.62043297290802"
"you would not have understood it","0.0","-1.5623102188110352"
"i hardly  understood it myself","0.0","-0.24327227473258972"
"i only knew that i had seen perfection face to  face, and that the world had become wonderful to my eyes  too  wonderful, perhaps, for in such mad worships there is peril, the peril  of losing them, no less than the peril of keeping them","1.0","3.8656549453735352"
"weeks and  weeks went on, and i grew more and more absorbed in you","1.0","5.2975912094116211"
"then came a  new development","0.0","-1.825708270072937"
"i had drawn you as paris in dainty armour, and as  adonis with huntsman's cloak and polished boar spear","1.0","6.4191265106201172"
"crowned with  heavy lotus blossoms you had sat on the prow of adrian's barge, gazing  across the green turbid nile","0.0","-1.0070915222167969"
"you had leaned over the still pool of  some greek woodland and seen in the water's silent silver the marvel of  your own face","1.0","3.8521633148193359"
"and it had all been what art should be  unconscious,  ideal, and remote","1.0","0.25133109092712402"
"one day, a fatal day i sometimes think, i  determined to paint a wonderful portrait of you as you actually are,  not in the costume of dead ages, but in your own dress and in your own  time","1.0","3.5354523658752441"
"whether it was the realism of the method, or the mere wonder of  your own personality, thus directly presented to me without mist or  veil, i cannot tell","0.0","-0.99918758869171143"
"but i know that as i worked at it, every flake  and film of colour seemed to me to reveal my secret","1.0","1.578160285949707"
"i grew afraid  that others would know of my idolatry","1.0","1.3912508487701416"
"i felt, dorian, that i had told  too much, that i had put too much of myself into it","0.0","-3.2086606025695801"
"then it was that  i resolved never to allow the picture to be exhibited","1.0","2.5935707092285156"
"you were a  little annoyed  but then you did not realize all that it meant to me","0.0","-4.7813644409179688"
"harry, to whom i talked about it, laughed at me","1.0","1.0719096660614014"
"but i did not mind  that","1.0","0.47038152813911438"
"when the picture was finished, and i sat alone with it, i felt  that i was right     well, after a few days the thing left my studio,  and as soon as i had got rid of the intolerable fascination of its  presence, it seemed to me that i had been foolish in imagining that i  had seen anything in it, more than that you were extremely good looking  and that i could paint","0.0","-2.1922891139984131"
"even now i cannot help feeling that it is a  mistake to think that the passion one feels in creation is ever really  shown in the work one creates","0.0","-2.575136661529541"
"art is always more abstract than we  fancy","1.0","1.7903599739074707"
"form and colour tell us of form and colour  that is all","1.0","6.6902174949645996"
"it  often seems to me that art conceals the artist far more completely than  it ever reveals him","1.0","1.0220756530761719"
"and so when i got this offer from paris, i  determined to make your portrait the principal thing in my exhibition","1.0","4.2597370147705078"
"it never occurred to me that you would refuse","0.0","-1.072838306427002"
"i see now that you were  right","1.0","2.5840768814086914"
"the picture cannot be shown","0.0","-7.2436351776123047"
"you must not be angry with me,  dorian, for what i have told you","1.0","2.0620417594909668"
"as i said to harry, once, you are  made to be worshipped","1.0","0.43079763650894165"
"dorian gray drew a long breath","1.0","1.7275972366333008"
"the colour came back to his cheeks,  and a smile played about his lips","1.0","3.1620683670043945"
"the peril was over","0.0","-1.8999508619308472"
"he was safe  for the time","1.0","1.2627031803131104"
"yet he could not help feeling infinite pity for the  painter who had just made this strange confession to him, and wondered  if he himself would ever be so dominated by the personality of a  friend","1.0","1.925546407699585"
"lord henry had the charm of being very dangerous","0.0","-1.2419512271881104"
"but that  was all","0.0","-1.6822292804718018"
"he was too clever and too cynical to be really fond of","0.0","-8.7416973114013672"
"would there ever be some one who would fill him with a strange  idolatry?","0.0","-0.1484602689743042"
"was that one of the things that life had in store?","0.0","-4.2406377792358398"
"it is extraordinary to me, dorian,  said hallward,  that you should  have seen this in the portrait","1.0","1.561748743057251"
"did you really see it?","0.0","-1.1467752456665039"
"i saw something in it,  he answered,  something that seemed to me very  curious","1.0","1.2755899429321289"
"well, you don't mind my looking at the thing now?","0.0","-1.6707718372344971"
"dorian shook his head","0.0","-1.1372025012969971"
"you must not ask me that, basil","1.0","0.72211968898773193"
"i could not  possibly let you stand in front of that picture","0.0","-0.65182745456695557"
"you will some day, surely?","0.0","-0.70567715167999268"
"never","0.0","-0.038953118026256561"
"well, perhaps you are right","1.0","3.3446774482727051"
"and now good bye, dorian","1.0","2.8155629634857178"
"you have been  the one person in my life who has really influenced my art","1.0","1.3258157968521118"
"whatever i  have done that is good, i owe to you","1.0","1.7299532890319824"
"ah!","1.0","0.97132778167724609"
"you don't know what it cost  me to tell you all that i have told you","1.0","0.19640146195888519"
"my dear basil,  said dorian,  what have you told me?","0.0","-2.0418214797973633"
"simply that you  felt that you admired me too much","0.0","-0.2566407322883606"
"that is not even a compliment","1.0","0.93597519397735596"
"it was not intended as a compliment","1.0","1.9755805730819702"
"it was a confession","0.0","-0.16796472668647766"
"now that i  have made it, something seems to have gone out of me","0.0","-2.4468216896057129"
"perhaps one  should never put one's worship into words","0.0","-0.14815413951873779"
"it was a very disappointing confession","0.0","-2.0226974487304688"
"why, what did you expect, dorian?","1.0","1.1537308692932129"
"you didn't see anything else in the  picture, did you?","0.0","-2.1872165203094482"
"there was nothing else to see?","0.0","-6.4672489166259766"
"no  there was nothing else to see","0.0","-8.0327777862548828"
"why do you ask?","0.0","-1.0723986625671387"
"but you mustn't  talk about worship","1.0","2.4174842834472656"
"it is foolish","0.0","-3.0093178749084473"
"you and i are friends, basil, and  we must always remain so","1.0","1.8778665065765381"
"you have got harry,  said the painter sadly","0.0","-3.8943543434143066"
"oh, harry!","1.0","0.37302547693252563"
"cried the lad, with a ripple of laughter","1.0","4.5464038848876953"
"harry spends  his days in saying what is incredible and his evenings in doing what is  improbable","1.0","6.3236103057861328"
"just the sort of life i would like to lead","1.0","0.018227502703666687"
"but still i  don't think i would go to harry if i were in trouble","1.0","0.15080581605434418"
"i would sooner  go to you, basil","1.0","3.3702855110168457"
"you will sit to me again?","0.0","-2.7986230850219727"
"impossible!","1.0","0.91228252649307251"
"you spoil my life as an artist by refusing, dorian","1.0","3.279688835144043"
"no man comes  across two ideal things","1.0","1.0468329191207886"
"few come across one","0.0","-2.7292859554290771"
"i can't explain it to you, basil, but i must never sit to you again","1.0","0.07429051399230957"
"there is something fatal about a portrait","0.0","-0.89407813549041748"
"it has a life of its own","1.0","3.758026123046875"
"i will come and have tea with you","1.0","2.345860481262207"
"that will be just as pleasant","0.0","-0.20872825384140015"
"pleasanter for you, i am afraid,  murmured hallward regretfully","1.0","4.1767721176147461"
"and  now good bye","1.0","2.354517936706543"
"i am sorry you won't let me look at the picture once  again","0.0","-2.2359409332275391"
"but that can't be helped","0.0","-0.75554084777832031"
"i quite understand what you feel  about it","1.0","1.6525437831878662"
"as he left the room, dorian gray smiled to himself","0.0","-3.3443996906280518"
"poor basil!","1.0","0.05826742947101593"
"how  little he knew of the true reason!","1.0","1.3058383464813232"
"and how strange it was that,  instead of having been forced to reveal his own secret, he had  succeeded, almost by chance, in wresting a secret from his friend!","0.0","-1.0902438163757324"
"how  much that strange confession explained to him!","1.0","1.1651427745819092"
"the painter's absurd  fits of jealousy, his wild devotion, his extravagant panegyrics, his  curious reticences  he understood them all now, and he felt sorry","1.0","1.3550279140472412"
"there seemed to him to be something tragic in a friendship so coloured  by romance","0.0","-2.3218388557434082"
"he sighed and touched the bell","1.0","3.1830072402954102"
"the portrait must be hidden away at  all costs","1.0","2.7822685241699219"
"he could not run such a risk of discovery again","1.0","5.617039680480957"
"it had  been mad of him to have allowed the thing to remain, even for an hour,  in a room to which any of his friends had access","0.0","-3.9918389320373535"
"chapter 10    when his servant entered, he looked at him steadfastly and wondered if  he had thought of peering behind the screen","0.0","-0.25832915306091309"
"the man was quite  impassive and waited for his orders","0.0","-2.5513579845428467"
"dorian lit a cigarette and walked  over to the glass and glanced into it","0.0","-2.4073050022125244"
"he could see the reflection of  victor's face perfectly","1.0","4.6199784278869629"
"it was like a placid mask of servility","1.0","0.45352423191070557"
"there was nothing to be afraid of, there","0.0","-3.2071585655212402"
"yet he thought it best to be  on his guard","1.0","3.4513378143310547"
"speaking very slowly, he told him to tell the house keeper that he  wanted to see her, and then to go to the frame maker and ask him to  send two of his men round at once","1.0","1.171022891998291"
"it seemed to him that as the man  left the room his eyes wandered in the direction of the screen","0.0","-2.7046108245849609"
"or was  that merely his own fancy?","0.0","-1.566097617149353"
"after a few moments, in her black silk dress, with old fashioned thread  mittens on her wrinkled hands, mrs","0.0","-1.467888355255127"
"leaf bustled into the library","1.0","1.5432130098342896"
"he  asked her for the key of the schoolroom","1.0","2.2746193408966064"
"the old schoolroom, mr","1.0","1.2027689218521118"
"dorian?","0.0","-1.1287322044372559"
"she exclaimed","0.0","-0.10881910473108292"
"why, it is full of  dust","1.0","3.0372848510742188"
"i must get it arranged and put straight before you go into it","0.0","-0.60711443424224854"
"it is not fit for you to see, sir","0.0","-0.65101832151412964"
"it is not, indeed","0.0","-2.2437827587127686"
