"Text","Binary_Sentiment","Cont_Sentiment"
"it is rather  horrid of me, as he has sent me my portrait in the most wonderful  frame, specially designed by himself, and, though i am a little jealous  of the picture for being a whole month younger than i am, i must admit  that i delight in it","1.0","0.96112477779388428"
"perhaps you had better write to him","0.0","-6.7346563339233398"
"i don't  want to see him alone","0.0","-0.36863750219345093"
"he says things that annoy me","0.0","-0.28144228458404541"
"he gives me good  advice","0.0","-1.2955036163330078"
"lord henry smiled","0.0","-0.13790991902351379"
"people are very fond of giving away what they need  most themselves","0.0","-3.6160669326782227"
"it is what i call the depth of generosity","1.0","1.2900471687316895"
"oh, basil is the best of fellows, but he seems to me to be just a bit  of a philistine","1.0","0.62687075138092041"
"since i have known you, harry, i have discovered  that","0.0","-0.44961202144622803"
"basil, my dear boy, puts everything that is charming in him into his  work","1.0","1.5654137134552002"
"the consequence is that he has nothing left for life but his  prejudices, his principles, and his common sense","1.0","0.63974249362945557"
"the only artists i  have ever known who are personally delightful are bad artists","1.0","1.8548760414123535"
"good  artists exist simply in what they make, and consequently are perfectly  uninteresting in what they are","1.0","0.039416186511516571"
"a great poet, a really great poet, is  the most unpoetical of all creatures","1.0","0.50651949644088745"
"but inferior poets are  absolutely fascinating","0.0","-2.5191166400909424"
"the worse their rhymes are, the more  picturesque they look","1.0","0.30307871103286743"
"the mere fact of having published a book of  second rate sonnets makes a man quite irresistible","1.0","3.0067322254180908"
"he lives the  poetry that he cannot write","0.0","-2.092825174331665"
"the others write the poetry that they  dare not realize","0.0","-2.2107009887695312"
"i wonder is that really so, harry?","0.0","-3.4488224983215332"
"said dorian gray, putting some  perfume on his handkerchief out of a large, gold topped bottle that  stood on the table","0.0","-1.1285367012023926"
"it must be, if you say it","1.0","2.5064396858215332"
"and now i am off","1.0","1.4660904407501221"
"imogen is waiting for me","0.0","-0.6615944504737854"
"don't forget about to morrow","0.0","-1.7877745628356934"
"good bye","1.0","0.49919641017913818"
"as he left the room, lord henry's heavy eyelids drooped, and he began  to think","0.0","-6.0636634826660156"
"certainly few people had ever interested him so much as  dorian gray, and yet the lad's mad adoration of some one else caused  him not the slightest pang of annoyance or jealousy","0.0","-0.66390824317932129"
"he was pleased by  it","1.0","0.64345026016235352"
"it made him a more interesting study","1.0","0.1214030534029007"
"he had been always  enthralled by the methods of natural science, but the ordinary  subject matter of that science had seemed to him trivial and of no  import","0.0","-1.6640210151672363"
"and so he had begun by vivisecting himself, as he had ended by  vivisecting others","0.0","-2.9138126373291016"
"human life  that appeared to him the one thing  worth investigating","0.0","-3.8957579135894775"
"compared to it there was nothing else of any  value","0.0","-6.0744972229003906"
"it was true that as one watched life in its curious crucible of  pain and pleasure, one could not wear over one's face a mask of glass,  nor keep the sulphurous fumes from troubling the brain and making the  imagination turbid with monstrous fancies and misshapen dreams","0.0","-1.2958471775054932"
"there  were poisons so subtle that to know their properties one had to sicken  of them","0.0","-2.3268647193908691"
"there were maladies so strange that one had to pass through  them if one sought to understand their nature","0.0","-2.734095573425293"
"and, yet, what a great  reward one received!","1.0","5.2619633674621582"
"how wonderful the whole world became to one!","1.0","0.59225004911422729"
"to  note the curious hard logic of passion, and the emotional coloured life  of the intellect  to observe where they met, and where they separated,  at what point they were in unison, and at what point they were at  discord  there was a delight in that!","1.0","0.72913146018981934"
"what matter what the cost was?","0.0","-1.440122127532959"
"one could never pay too high a price for any sensation","0.0","-1.2553638219833374"
"he was conscious  and the thought brought a gleam of pleasure into his  brown agate eyes  that it was through certain words of his, musical  words said with musical utterance, that dorian gray's soul had turned  to this white girl and bowed in worship before her","1.0","0.82153522968292236"
"to a large extent  the lad was his own creation","1.0","3.4710273742675781"
"he had made him premature","0.0","-2.2464241981506348"
"that was  something","0.0","-1.5058929920196533"
"ordinary people waited till life disclosed to them its  secrets, but to the few, to the elect, the mysteries of life were  revealed before the veil was drawn away","0.0","-2.6209919452667236"
"sometimes this was the effect  of art, and chiefly of the art of literature, which dealt immediately  with the passions and the intellect","1.0","3.1653821468353271"
"but now and then a complex  personality took the place and assumed the office of art, was indeed,  in its way, a real work of art, life having its elaborate masterpieces,  just as poetry has, or sculpture, or painting","0.0","-0.32216048240661621"
"yes, the lad was premature","1.0","0.75117719173431396"
"he was gathering his harvest while it was  yet spring","1.0","0.65722793340682983"
"the pulse and passion of youth were in him, but he was  becoming self conscious","0.0","-2.4085173606872559"
"it was delightful to watch him","1.0","2.7489261627197266"
"with his  beautiful face, and his beautiful soul, he was a thing to wonder at","1.0","2.7488903999328613"
"it was no matter how it all ended, or was destined to end","0.0","-2.0063011646270752"
"he was like  one of those gracious figures in a pageant or a play, whose joys seem  to be remote from one, but whose sorrows stir one's sense of beauty,  and whose wounds are like red roses","1.0","4.0226278305053711"
"soul and body, body and soul  how mysterious they were!","0.0","-0.075067862868309021"
"there was  animalism in the soul, and the body had its moments of spirituality","0.0","-0.98818278312683105"
"the senses could refine, and the intellect could degrade","1.0","1.8568592071533203"
"who could  say where the fleshly impulse ceased, or the psychical impulse began?","1.0","0.074944630265235901"
"how shallow were the arbitrary definitions of ordinary psychologists!","0.0","-7.6092681884765625"
"and yet how difficult to decide between the claims of the various  schools!","0.0","-4.1515626907348633"
"was the soul a shadow seated in the house of sin?","0.0","-0.27679377794265747"
"or was the  body really in the soul, as giordano bruno thought?","0.0","-1.5654870271682739"
"the separation of  spirit from matter was a mystery, and the union of spirit with matter  was a mystery also","1.0","3.6722841262817383"
"he began to wonder whether we could ever make psychology so absolute a  science that each little spring of life would be revealed to us","1.0","0.65197533369064331"
"as it  was, we always misunderstood ourselves and rarely understood others","1.0","5.3287167549133301"
"experience was of no ethical value","0.0","-1.3227853775024414"
"it was merely the name men gave to  their mistakes","0.0","-5.8847808837890625"
"moralists had, as a rule, regarded it as a mode of  warning, had claimed for it a certain ethical efficacy in the formation  of character, had praised it as something that taught us what to follow  and showed us what to avoid","1.0","2.4940781593322754"
"but there was no motive power in  experience","0.0","-1.8902261257171631"
"it was as little of an active cause as conscience itself","1.0","0.79401695728302002"
"all that it really demonstrated was that our future would be the same  as our past, and that the sin we had done once, and with loathing, we  would do many times, and with joy","1.0","0.59961891174316406"
"it was clear to him that the experimental method was the only method by  which one could arrive at any scientific analysis of the passions  and  certainly dorian gray was a subject made to his hand, and seemed to  promise rich and fruitful results","1.0","1.0190739631652832"
"his sudden mad love for sibyl vane  was a psychological phenomenon of no small interest","1.0","1.0582892894744873"
"there was no  doubt that curiosity had much to do with it, curiosity and the desire  for new experiences, yet it was not a simple, but rather a very complex  passion","0.0","-1.1979942321777344"
"what there was in it of the purely sensuous instinct of  boyhood had been transformed by the workings of the imagination,  changed into something that seemed to the lad himself to be remote from  sense, and was for that very reason all the more dangerous","0.0","-0.60352927446365356"
"it was the  passions about whose origin we deceived ourselves that tyrannized most  strongly over us","1.0","1.0103870630264282"
"our weakest motives were those of whose nature we  were conscious","0.0","-4.6640520095825195"
"it often happened that when we thought we were  experimenting on others we were really experimenting on ourselves","0.0","-1.5748913288116455"
"while lord henry sat dreaming on these things, a knock came to the  door, and his valet entered and reminded him it was time to dress for  dinner","0.0","-6.59246826171875"
"he got up and looked out into the street","0.0","-3.1365351676940918"
"the sunset had  smitten into scarlet gold the upper windows of the houses opposite","0.0","-4.3859519958496094"
"the panes glowed like plates of heated metal","0.0","-4.8653345108032227"
"the sky above was like a  faded rose","0.0","-1.7086522579193115"
"he thought of his friend's young fiery coloured life and  wondered how it was all going to end","1.0","4.8932175636291504"
"when he arrived home, about half past twelve o'clock, he saw a telegram  lying on the hall table","0.0","-2.082611083984375"
"he opened it and found it was from dorian  gray","1.0","1.6799681186676025"
"it was to tell him that he was engaged to be married to sibyl  vane","0.0","-2.556373119354248"
"chapter 5     mother, mother, i am so happy!","1.0","4.2672920227050781"
"whispered the girl, burying her face  in the lap of the faded, tired looking woman who, with back turned to  the shrill intrusive light, was sitting in the one arm chair that their  dingy sitting room contained","0.0","-4.5019207000732422"
"i am so happy!","1.0","2.9608278274536133"
"she repeated,  and you  must be happy, too!","1.0","2.9566984176635742"
"mrs  vane winced and put her thin, bismuth whitened hands on her  daughter's head","0.0","-2.3198773860931396"
"happy!","1.0","1.6346354484558105"
"she echoed,  i am only happy, sibyl, when i  see you act","1.0","3.187345027923584"
"you must not think of anything but your acting","1.0","0.74487400054931641"
"mr   isaacs has been very good to us, and we owe him money","1.0","1.1781895160675049"
"the girl looked up and pouted","0.0","-1.6322067975997925"
"money, mother?","0.0","-1.9822820425033569"
"she cried,  what does  money matter?","0.0","-3.5895504951477051"
"love is more than money","0.0","-3.3358373641967773"
"mr  isaacs has advanced us fifty pounds to pay off our debts and to  get a proper outfit for james","1.0","3.0440177917480469"
"you must not forget that, sibyl","1.0","0.75750863552093506"
"fifty  pounds is a very large sum","0.0","-0.18224799633026123"
"mr  isaacs has been most considerate","1.0","1.407827615737915"
"he is not a gentleman, mother, and i hate the way he talks to me,   said the girl, rising to her feet and going over to the window","0.0","-0.97741538286209106"
"i don't know how we could manage without him,  answered the elder  woman querulously","1.0","2.2659711837768555"
"sibyl vane tossed her head and laughed","0.0","-1.168184757232666"
"we don't want him any more,  mother","1.0","0.045874848961830139"
"prince charming rules life for us now","1.0","5.4090127944946289"
"then she paused","0.0","-1.18375563621521"
"a  rose shook in her blood and shadowed her cheeks","1.0","1.1099276542663574"
"quick breath parted  the petals of her lips","1.0","1.6193805932998657"
"they trembled","1.0","0.0056894868612289429"
"some southern wind of passion  swept over her and stirred the dainty folds of her dress","0.0","-0.2898026704788208"
"i love  him,  she said simply","0.0","-2.0686347484588623"
"foolish child!","1.0","0.030635103583335876"
"foolish child!","1.0","0.030635103583335876"
"was the parrot phrase flung in answer","0.0","-7.0105972290039062"
"the waving of crooked, false jewelled fingers gave grotesqueness to the  words","0.0","-0.53861451148986816"
"the girl laughed again","1.0","2.5904130935668945"
"the joy of a caged bird was in her voice","0.0","-0.49194818735122681"
"her  eyes caught the melody and echoed it in radiance, then closed for a  moment, as though to hide their secret","0.0","-0.43302053213119507"
"when they opened, the mist of  a dream had passed across them","1.0","1.610598087310791"
"thin lipped wisdom spoke at her from the worn chair, hinted at  prudence, quoted from that book of cowardice whose author apes the name  of common sense","0.0","-5.2635879516601562"
"she did not listen","0.0","-1.0071206092834473"
"she was free in her prison of  passion","0.0","-1.432646632194519"
"her prince, prince charming, was with her","0.0","-0.53723305463790894"
"she had called on  memory to remake him","0.0","-1.3290073871612549"
"she had sent her soul to search for him, and it  had brought him back","0.0","-2.5067524909973145"
"his kiss burned again upon her mouth","1.0","3.3864717483520508"
"her  eyelids were warm with his breath","1.0","4.6520075798034668"
"then wisdom altered its method and spoke of espial and discovery","1.0","3.3595595359802246"
"this  young man might be rich","1.0","1.4076194763183594"
"if so, marriage should be thought of","1.0","0.66253793239593506"
"against the shell of her ear broke the waves of worldly cunning","1.0","3.312626838684082"
"the  arrows of craft shot by her","1.0","1.2820830345153809"
"she saw the thin lips moving, and smiled","1.0","0.59786295890808105"
"suddenly she felt the need to speak","0.0","-1.4678714275360107"
"the wordy silence troubled her","1.0","2.766887903213501"
"mother, mother,  she cried,  why does he love me so much?","0.0","-2.7251842021942139"
"i know why  i love him","1.0","0.15806984901428223"
"i love him because he is like what love himself should be","1.0","0.3452313244342804"
"but what does he see in me?","0.0","-2.4356255531311035"
"i am not worthy of him","1.0","0.48873507976531982"
"and yet  why, i  cannot tell  though i feel so much beneath him, i don't feel humble","0.0","-2.4440250396728516"
"i  feel proud, terribly proud","1.0","0.33338308334350586"
"mother, did you love my father as i love  prince charming?","0.0","-0.49849784374237061"
"the elder woman grew pale beneath the coarse powder that daubed her  cheeks, and her dry lips twitched with a spasm of pain","0.0","-0.20127879083156586"
"sybil rushed  to her, flung her arms round her neck, and kissed her","1.0","2.3469970226287842"
"forgive me,  mother","1.0","0.1870322972536087"
"i know it pains you to talk about our father","1.0","1.7757787704467773"
"but it only  pains you because you loved him so much","1.0","0.90921175479888916"
"don't look so sad","0.0","-0.26927748322486877"
"i am as  happy to day as you were twenty years ago","1.0","1.066153883934021"
"ah!","1.0","0.97132778167724609"
"let me be happy for  ever!","1.0","3.0080533027648926"
"my child, you are far too young to think of falling in love","0.0","-1.4403238296508789"
"besides,  what do you know of this young man?","1.0","0.7831038236618042"
"you don't even know his name","0.0","-3.6120948791503906"
"the  whole thing is most inconvenient, and really, when james is going away  to australia, and i have so much to think of, i must say that you  should have shown more consideration","0.0","-3.440887451171875"
"however, as i said before, if he  is rich          ah!","1.0","2.4629151821136475"
"mother, mother, let me be happy!","1.0","1.3438533544540405"
"mrs  vane glanced at her, and with one of those false theatrical  gestures that so often become a mode of second nature to a  stage player, clasped her in her arms","0.0","-1.1492481231689453"
"at this moment, the door opened  and a young lad with rough brown hair came into the room","1.0","2.4049923419952393"
"he was  thick set of figure, and his hands and feet were large and somewhat  clumsy in movement","0.0","-4.1972746849060059"
"he was not so finely bred as his sister","1.0","1.6943403482437134"
"one  would hardly have guessed the close relationship that existed between  them","1.0","0.44994914531707764"
"mrs  vane fixed her eyes on him and intensified her smile","1.0","2.3755440711975098"
"she  mentally elevated her son to the dignity of an audience","1.0","5.6739950180053711"
"she felt sure  that the  tableau  was interesting","1.0","0.36232060194015503"
"you might keep some of your kisses for me, sibyl, i think,  said the  lad with a good natured grumble","1.0","3.8224592208862305"
"ah!","1.0","0.97132778167724609"
"but you don't like being kissed, jim,  she cried","0.0","-1.0913321971893311"
"you are a  dreadful old bear","0.0","-6.0370283126831055"
"and she ran across the room and hugged him","0.0","-0.76988053321838379"
"james vane looked into his sister's face with tenderness","1.0","2.585503101348877"
"i want you  to come out with me for a walk, sibyl","1.0","1.6176160573959351"
"i don't suppose i shall ever  see this horrid london again","0.0","-7.0112748146057129"
"i am sure i don't want to","1.0","0.57041001319885254"
"my son, don't say such dreadful things,  murmured mrs  vane, taking up  a tawdry theatrical dress, with a sigh, and beginning to patch it","0.0","-3.8791112899780273"
"she  felt a little disappointed that he had not joined the group","0.0","-2.0084595680236816"
"it would  have increased the theatrical picturesqueness of the situation","0.0","-1.8833715915679932"
"why not, mother?","0.0","-1.4530332088470459"
"i mean it","0.0","-0.91627562046051025"
"you pain me, my son","1.0","0.83368515968322754"
"i trust you will return from australia in a  position of affluence","1.0","3.3747673034667969"
"i believe there is no society of any kind in  the colonies  nothing that i would call society  so when you have made  your fortune, you must come back and assert yourself in london","0.0","-0.91159403324127197"
"society!","1.0","1.1688699722290039"
"muttered the lad","1.0","1.4808683395385742"
"i don't want to know anything about  that","1.0","0.20007006824016571"
"i should like to make some money to take you and sibyl off the  stage","0.0","-0.95310652256011963"
"i hate it","0.0","-0.20395764708518982"
"oh, jim!","0.0","-0.11173476278781891"
"said sibyl, laughing,  how unkind of you!","1.0","1.910981297492981"
"but are you  really going for a walk with me?","0.0","-1.0412604808807373"
"that will be nice!","1.0","3.8064312934875488"
"i was afraid you  were going to say good bye to some of your friends  to tom hardy, who  gave you that hideous pipe, or ned langton, who makes fun of you for  smoking it","1.0","3.5437114238739014"
"it is very sweet of you to let me have your last  afternoon","1.0","0.13626354932785034"
"where shall we go?","0.0","-4.0666017532348633"
"let us go to the park","1.0","1.8333983421325684"
"i am too shabby,  he answered, frowning","0.0","-6.2528576850891113"
"only swell people go to the  park","1.0","0.9065966010093689"
"nonsense, jim,  she whispered, stroking the sleeve of his coat","1.0","1.9802857637405396"
"he hesitated for a moment","0.0","-0.28497800230979919"
"very well,  he said at last,  but don't be  too long dressing","0.0","-7.5131978988647461"
"she danced out of the door","1.0","0.096310742199420929"
"one could hear her  singing as she ran upstairs","1.0","1.3972761631011963"
"her little feet pattered overhead","0.0","-1.6519534587860107"
"he walked up and down the room two or three times","0.0","-4.8129186630249023"
"then he turned to  the still figure in the chair","0.0","-5.7175779342651367"
"mother, are my things ready?","0.0","-1.3707239627838135"
"he asked","0.0","-1.6593160629272461"
"quite ready, james,  she answered, keeping her eyes on her work","1.0","4.4364986419677734"
"for  some months past she had felt ill at ease when she was alone with this  rough stern son of hers","0.0","-4.5745000839233398"
"her shallow secret nature was troubled when  their eyes met","0.0","-3.2431552410125732"
"she used to wonder if he suspected anything","0.0","-2.404714822769165"
"the  silence, for he made no other observation, became intolerable to her","0.0","-1.8536220788955688"
"she began to complain","0.0","-1.4531657695770264"
"women defend themselves by attacking, just as  they attack by sudden and strange surrenders","1.0","0.76959550380706787"
"i hope you will be  contented, james, with your sea faring life,  she said","1.0","4.8718676567077637"
"you must  remember that it is your own choice","1.0","6.7116785049438477"
"you might have entered a  solicitor's office","0.0","-2.1001949310302734"
"solicitors are a very respectable class, and in  the country often dine with the best families","1.0","3.9216375350952148"
"i hate offices, and i hate clerks,  he replied","1.0","1.4290461540222168"
"but you are quite  right","1.0","1.1656619310379028"
"i have chosen my own life","0.0","-2.0172557830810547"
"all i say is, watch over sibyl","1.0","0.44302496314048767"
"don't let her come to any harm","0.0","-4.8180737495422363"
"mother, you must watch over her","1.0","3.3066678047180176"
"james, you really talk very strangely","1.0","2.1231307983398438"
"of course i watch over sibyl","0.0","-0.011396564543247223"
"i hear a gentleman comes every night to the theatre and goes behind to  talk to her","1.0","1.5400372743606567"
"is that right?","0.0","-0.60259586572647095"
"what about that?","0.0","-0.99362236261367798"
"you are speaking about things you don't understand, james","0.0","-0.78066301345825195"
"in the  profession we are accustomed to receive a great deal of most gratifying  attention","1.0","3.5781934261322021"
"i myself used to receive many bouquets at one time","1.0","1.8674396276473999"
"that  was when acting was really understood","0.0","-4.2580056190490723"
"as for sibyl, i do not know at  present whether her attachment is serious or not","0.0","-2.0981130599975586"
"but there is no  doubt that the young man in question is a perfect gentleman","1.0","1.2294535636901855"
"he is  always most polite to me","1.0","1.0738158226013184"
"besides, he has the appearance of being  rich, and the flowers he sends are lovely","1.0","2.1960415840148926"
"you don't know his name, though,  said the lad harshly","0.0","-0.30566540360450745"
"no,  answered his mother with a placid expression in her face","1.0","2.457944393157959"
"he  has not yet revealed his real name","0.0","-2.1194863319396973"
"i think it is quite romantic of  him","1.0","0.81425356864929199"
"he is probably a member of the aristocracy","1.0","3.7580804824829102"
"james vane bit his lip","1.0","2.196669340133667"
"watch over sibyl, mother,  he cried,  watch  over her","1.0","1.6505410671234131"
"my son, you distress me very much","0.0","-0.56106728315353394"
"sibyl is always under my special  care","1.0","1.9205293655395508"
"of course, if this gentleman is wealthy, there is no reason why  she should not contract an alliance with him","0.0","-4.7190933227539062"
"i trust he is one of the  aristocracy","1.0","1.6355905532836914"
"he has all the appearance of it, i must say","1.0","2.9178256988525391"
"it might be  a most brilliant marriage for sibyl","1.0","5.9388036727905273"
"they would make a charming  couple","1.0","3.0111923217773438"
"his good looks are really quite remarkable  everybody notices  them","1.0","2.9235072135925293"
"the lad muttered something to himself and drummed on the window pane  with his coarse fingers","0.0","-1.1231579780578613"
"he had just turned round to say something  when the door opened and sibyl ran in","1.0","1.0351409912109375"
"how serious you both are!","1.0","2.1911232471466064"
"she cried","0.0","-0.57377034425735474"
"what is the matter?","0.0","-1.2248595952987671"
"nothing,  he answered","0.0","-0.56815469264984131"
"i suppose one must be serious sometimes","0.0","-5.0685386657714844"
"good bye, mother  i will have my dinner at five o'clock","0.0","-6.6169891357421875"
"everything is  packed, except my shirts, so you need not trouble","0.0","-0.70556330680847168"
"good bye, my son,  she answered with a bow of strained stateliness","1.0","0.6292651891708374"
"she was extremely annoyed at the tone he had adopted with her, and  there was something in his look that had made her feel afraid","0.0","-2.7519943714141846"
"kiss me, mother,  said the girl","1.0","1.2547872066497803"
"her flowerlike lips touched the  withered cheek and warmed its frost","1.0","2.0036909580230713"
"my child!","1.0","1.4023276567459106"
"my child!","1.0","1.4023276567459106"
"cried mrs  vane, looking up to the ceiling in  search of an imaginary gallery","0.0","-5.962181568145752"
"come, sibyl,  said her brother impatiently","1.0","0.04183492437005043"
"he hated his mother's  affectations","1.0","1.7880409955978394"
