"Text","Binary_Sentiment","Cont_Sentiment"
"the picture of dorian gray    by    oscar wilde          the preface    the artist is the creator of beautiful things","1.0","4.8913640975952148"
"to reveal art and  conceal the artist is art's aim","1.0","3.9889650344848633"
"the critic is he who can translate  into another manner or a new material his impression of beautiful  things","1.0","2.8818717002868652"
"the highest as the lowest form of criticism is a mode of autobiography","0.0","-3.9116332530975342"
"those who find ugly meanings in beautiful things are corrupt without  being charming","1.0","0.83972573280334473"
"this is a fault","0.0","-5.5841836929321289"
"those who find beautiful meanings in beautiful things are the  cultivated","1.0","2.666020393371582"
"for these there is hope","0.0","-1.635578989982605"
"they are the elect to whom  beautiful things mean only beauty","1.0","2.1362953186035156"
"there is no such thing as a moral or an immoral book","0.0","-2.0184326171875"
"books are well  written, or badly written","0.0","-5.5458097457885742"
"that is all","0.0","-0.091526053845882416"
"the nineteenth century dislike of realism is the rage of caliban seeing  his own face in a glass","1.0","1.4413902759552002"
"the nineteenth century dislike of romanticism is the rage of caliban  not seeing his own face in a glass","1.0","0.65137290954589844"
"the moral life of man forms part  of the subject matter of the artist, but the morality of art consists  in the perfect use of an imperfect medium","1.0","4.0784158706665039"
"no artist desires to prove  anything","1.0","0.18987758457660675"
"even things that are true can be proved","0.0","-0.31895333528518677"
"no artist has  ethical sympathies","1.0","3.4776530265808105"
"an ethical sympathy in an artist is an  unpardonable mannerism of style","1.0","3.5516500473022461"
"no artist is ever morbid","1.0","3.6936535835266113"
"the artist  can express everything","1.0","2.1466226577758789"
"thought and language are to the artist  instruments of an art","1.0","3.8211798667907715"
"vice and virtue are to the artist materials for  an art","1.0","2.829707145690918"
"from the point of view of form, the type of all the arts is  the art of the musician","1.0","3.5406489372253418"
"from the point of view of feeling, the  actor's craft is the type","1.0","2.2301309108734131"
"all art is at once surface and symbol","0.0","-0.31604522466659546"
"those who go beneath the surface do so at their peril","1.0","1.4901728630065918"
"those who read  the symbol do so at their peril","1.0","3.1987648010253906"
"it is the spectator, and not life,  that art really mirrors","1.0","3.714604377746582"
"diversity of opinion about a work of art  shows that the work is new, complex, and vital","1.0","4.4363913536071777"
"when critics disagree,  the artist is in accord with himself","0.0","-0.23408466577529907"
"we can forgive a man for making  a useful thing as long as he does not admire it","0.0","-1.3725595474243164"
"the only excuse for  making a useless thing is that one admires it intensely","0.0","-6.1583404541015625"
"all art is quite useless","0.0","-3.1787960529327393"
"oscar wilde          chapter 1    the studio was filled with the rich odour of roses, and when the light  summer wind stirred amidst the trees of the garden, there came through  the open door the heavy scent of the lilac, or the more delicate  perfume of the pink flowering thorn","0.0","-0.1029706746339798"
"from the corner of the divan of persian saddle bags on which he was  lying, smoking, as was his custom, innumerable cigarettes, lord henry  wotton could just catch the gleam of the honey sweet and honey coloured  blossoms of a laburnum, whose tremulous branches seemed hardly able to  bear the burden of a beauty so flamelike as theirs  and now and then  the fantastic shadows of birds in flight flitted across the long  tussore silk curtains that were stretched in front of the huge window,  producing a kind of momentary japanese effect, and making him think of  those pallid, jade faced painters of tokyo who, through the medium of  an art that is necessarily immobile, seek to convey the sense of  swiftness and motion","0.0","-0.05821855366230011"
"the sullen murmur of the bees shouldering their  way through the long unmown grass, or circling with monotonous  insistence round the dusty gilt horns of the straggling woodbine,  seemed to make the stillness more oppressive","0.0","-2.1098222732543945"
"the dim roar of london  was like the bourdon note of a distant organ","0.0","-1.6329357624053955"
"in the centre of the room, clamped to an upright easel, stood the  full length portrait of a young man of extraordinary personal beauty,  and in front of it, some little distance away, was sitting the artist  himself, basil hallward, whose sudden disappearance some years ago  caused, at the time, such public excitement and gave rise to so many  strange conjectures","1.0","3.0202062129974365"
"as the painter looked at the gracious and comely form he had so  skilfully mirrored in his art, a smile of pleasure passed across his  face, and seemed about to linger there","1.0","1.7284729480743408"
"but he suddenly started up,  and closing his eyes, placed his fingers upon the lids, as though he  sought to imprison within his brain some curious dream from which he  feared he might awake","1.0","3.7784132957458496"
"it is your best work, basil, the best thing you have ever done,  said  lord henry languidly","1.0","0.72144508361816406"
"you must certainly send it next year to the  grosvenor","1.0","3.1372668743133545"
"the academy is too large and too vulgar","0.0","-7.3201384544372559"
"whenever i have  gone there, there have been either so many people that i have not been  able to see the pictures, which was dreadful, or so many pictures that  i have not been able to see the people, which was worse","0.0","-5.4361448287963867"
"the grosvenor  is really the only place","0.0","-2.5627632141113281"
"i don't think i shall send it anywhere,  he answered, tossing his head  back in that odd way that used to make his friends laugh at him at  oxford","0.0","-0.2742919921875"
"no, i won't send it anywhere","0.0","-0.21651488542556763"
"lord henry elevated his eyebrows and looked at him in amazement through  the thin blue wreaths of smoke that curled up in such fanciful whorls  from his heavy, opium tainted cigarette","0.0","-4.6104912757873535"
"not send it anywhere?","0.0","-2.1670422554016113"
"my  dear fellow, why?","0.0","-1.1959033012390137"
"have you any reason?","0.0","-2.9947860240936279"
"what odd chaps you painters  are!","1.0","2.1098687648773193"
"you do anything in the world to gain a reputation","1.0","1.7613861560821533"
"as soon as  you have one, you seem to want to throw it away","0.0","-2.2580041885375977"
"it is silly of you,  for there is only one thing in the world worse than being talked about,  and that is not being talked about","0.0","-3.2234652042388916"
"a portrait like this would set you  far above all the young men in england, and make the old men quite  jealous, if old men are ever capable of any emotion","1.0","2.4714827537536621"
"i know you will laugh at me,  he replied,  but i really can't exhibit  it","0.0","-2.4004573822021484"
"i have put too much of myself into it","0.0","-3.8185958862304688"
"lord henry stretched himself out on the divan and laughed","0.0","-3.9718413352966309"
"yes, i knew you would  but it is quite true, all the same","1.0","2.7007393836975098"
"too much of yourself in it!","0.0","-2.7194862365722656"
"upon my word, basil, i didn't know you  were so vain  and i really can't see any resemblance between you, with  your rugged strong face and your coal black hair, and this young  adonis, who looks as if he was made out of ivory and rose leaves","0.0","-0.9717872142791748"
"why,  my dear basil, he is a narcissus, and you  well, of course you have an  intellectual expression and all that","0.0","-1.1511714458465576"
"but beauty, real beauty, ends  where an intellectual expression begins","1.0","3.7114808559417725"
"intellect is in itself a mode  of exaggeration, and destroys the harmony of any face","0.0","-0.41579246520996094"
"the moment one  sits down to think, one becomes all nose, or all forehead, or something  horrid","0.0","-2.2951231002807617"
"look at the successful men in any of the learned professions","0.0","-2.6897683143615723"
"how perfectly hideous they are!","0.0","-0.55499577522277832"
"except, of course, in the church","0.0","-0.49638593196868896"
"but  then in the church they don't think","0.0","-2.4953336715698242"
"a bishop keeps on saying at the  age of eighty what he was told to say when he was a boy of eighteen,  and as a natural consequence he always looks absolutely delightful","1.0","1.3948812484741211"
"your mysterious young friend, whose name you have never told me, but  whose picture really fascinates me, never thinks","0.0","-2.8022861480712891"
"i feel quite sure of  that","1.0","0.70526182651519775"
"he is some brainless beautiful creature who should be always  here in winter when we have no flowers to look at, and always here in  summer when we want something to chill our intelligence","0.0","-0.090810075402259827"
"don't flatter  yourself, basil   you are not in the least like him","0.0","-3.6725344657897949"
"you don't understand me, harry,  answered the artist","1.0","1.8961787223815918"
"of course i am  not like him","0.0","-0.32623445987701416"
"i know that perfectly well","1.0","4.214137077331543"
"indeed, i should be sorry  to look like him","0.0","-3.46732497215271"
"you shrug your shoulders?","0.0","-4.1582522392272949"
"i am telling you the  truth","1.0","3.7410993576049805"
"there is a fatality about all physical and intellectual  distinction, the sort of fatality that seems to dog through history the  faltering steps of kings","1.0","0.71876275539398193"
"it is better not to be different from one's  fellows","1.0","0.06951180100440979"
"the ugly and the stupid have the best of it in this world","0.0","-2.4592523574829102"
"they can sit at their ease and gape at the play","1.0","2.0014374256134033"
"if they know nothing  of victory, they are at least spared the knowledge of defeat","0.0","-2.3093500137329102"
"they  live as we all should live  undisturbed, indifferent, and without  disquiet","0.0","-3.6596636772155762"
"they neither bring ruin upon others, nor ever receive it  from alien hands","0.0","-0.10864324122667313"
"your rank and wealth, harry  my brains, such as they  are  my art, whatever it may be worth  dorian gray's good looks  we  shall all suffer for what the gods have given us, suffer terribly","0.0","-0.26162689924240112"
"dorian gray?","0.0","-1.8530211448669434"
"is that his name?","0.0","-5.2815532684326172"
"asked lord henry, walking across the  studio towards basil hallward","0.0","-0.2963554859161377"
"yes, that is his name","0.0","-1.8922398090362549"
"i didn't intend to tell it to you","0.0","-0.89683741331100464"
"but why not?","0.0","-4.0240650177001953"
"oh, i can't explain","0.0","-5.4992866516113281"
"when i like people immensely, i never tell their  names to any one","1.0","0.35857751965522766"
"it is like surrendering a part of them","1.0","3.409390926361084"
"i have  grown to love secrecy","1.0","2.0722918510437012"
"it seems to be the one thing that can make  modern life mysterious or marvellous to us","1.0","3.1916406154632568"
"the commonest thing is  delightful if one only hides it","0.0","-2.058100700378418"
"when i leave town now i never tell my  people where i am going","1.0","1.4158699512481689"
"if i did, i would lose all my pleasure","1.0","1.2052929401397705"
"it  is a silly habit, i dare say, but somehow it seems to bring a great  deal of romance into one's life","1.0","1.0135359764099121"
"i suppose you think me awfully  foolish about it?","0.0","-9.3586254119873047"
"not at all,  answered lord henry,  not at all, my dear basil","0.0","-0.10817049443721771"
"you  seem to forget that i am married, and the one charm of marriage is that  it makes a life of deception absolutely necessary for both parties","1.0","3.4081850051879883"
"i  never know where my wife is, and my wife never knows what i am doing","1.0","4.0966963768005371"
"when we meet  we do meet occasionally, when we dine out together, or go  down to the duke's  we tell each other the most absurd stories with the  most serious faces","0.0","-0.64574843645095825"
"my wife is very good at it  much better, in fact,  than i am","1.0","0.71297615766525269"
"she never gets confused over her dates, and i always do","0.0","-1.1121361255645752"
"but when she does find me out, she makes no row at all","0.0","-4.2876124382019043"
"i sometimes  wish she would  but she merely laughs at me","0.0","-2.4611959457397461"
"i hate the way you talk about your married life, harry,  said basil  hallward, strolling towards the door that led into the garden","1.0","5.1828584671020508"
"i  believe that you are really a very good husband, but that you are  thoroughly ashamed of your own virtues","1.0","3.9929080009460449"
"you are an extraordinary  fellow","1.0","5.4981040954589844"
"you never say a moral thing, and you never do a wrong thing","0.0","-2.8744411468505859"
"your cynicism is simply a pose","0.0","-1.4634790420532227"
"being natural is simply a pose, and the most irritating pose i know,   cried lord henry, laughing  and the two young men went out into the  garden together and ensconced themselves on a long bamboo seat that  stood in the shade of a tall laurel bush","0.0","-0.54356855154037476"
"the sunlight slipped over  the polished leaves","1.0","4.3281874656677246"
"in the grass, white daisies were tremulous","1.0","1.2367814779281616"
"after a pause, lord henry pulled out his watch","1.0","0.70686733722686768"
"i am afraid i must be  going, basil,  he murmured,  and before i go, i insist on your  answering a question i put to you some time ago","1.0","2.9410820007324219"
"what is that?","0.0","-1.1880083084106445"
"said the painter, keeping his eyes fixed on the ground","1.0","2.0227680206298828"
"you know quite well","1.0","1.1260151863098145"
"i do not, harry","0.0","-0.59856307506561279"
"well, i will tell you what it is","1.0","1.8917254209518433"
"i want you to explain to me why you  won't exhibit dorian gray's picture","0.0","-1.3030713796615601"
"i want the real reason","0.0","-0.23903095722198486"
"i told you the real reason","1.0","0.4603843092918396"
"no, you did not","0.0","-0.95908606052398682"
"you said it was because there was too much of  yourself in it","0.0","-6.0650515556335449"
"now, that is childish","0.0","-2.3682305812835693"
"harry,  said basil hallward, looking him straight in the face,  every  portrait that is painted with feeling is a portrait of the artist, not  of the sitter","1.0","3.4025411605834961"
"the sitter is merely the accident, the occasion","1.0","3.4318242073059082"
"it is  not he who is revealed by the painter  it is rather the painter who, on  the coloured canvas, reveals himself","1.0","1.9583384990692139"
"the reason i will not exhibit  this picture is that i am afraid that i have shown in it the secret of  my own soul","0.0","-3.3927416801452637"
"lord henry laughed","1.0","0.37168043851852417"
"and what is that?","0.0","-0.62304019927978516"
"he asked","0.0","-1.6593160629272461"
"i will tell you,  said hallward  but an expression of perplexity came  over his face","0.0","-0.74398553371429443"
"i am all expectation, basil,  continued his companion, glancing at him","1.0","5.3588809967041016"
"oh, there is really very little to tell, harry,  answered the painter    and i am afraid you will hardly understand it","1.0","0.28971859812736511"
"perhaps you will  hardly believe it","1.0","0.95081019401550293"
"lord henry smiled, and leaning down, plucked a pink petalled daisy from  the grass and examined it","0.0","-0.12464258074760437"
"i am quite sure i shall understand it,  he  replied, gazing intently at the little golden, white feathered disk,   and as for believing things, i can believe anything, provided that it  is quite incredible","1.0","2.1417207717895508"
"the wind shook some blossoms from the trees, and the heavy  lilac blooms, with their clustering stars, moved to and fro in the  languid air","1.0","3.1795201301574707"
"a grasshopper began to chirrup by the wall, and like a  blue thread a long thin dragon fly floated past on its brown gauze  wings","1.0","0.1698499470949173"
"lord henry felt as if he could hear basil hallward's heart  beating, and wondered what was coming","1.0","7.4123010635375977"
"the story is simply this,  said the painter after some time","0.0","-1.3571292161941528"
"two  months ago i went to a crush at lady brandon's","0.0","-2.1373000144958496"
"you know we poor  artists have to show ourselves in society from time to time, just to  remind the public that we are not savages","0.0","-1.3934187889099121"
"with an evening coat and a  white tie, as you told me once, anybody, even a stock broker, can gain  a reputation for being civilized","0.0","-0.070291340351104736"
"well, after i had been in the room  about ten minutes, talking to huge overdressed dowagers and tedious  academicians, i suddenly became conscious that some one was looking at  me","0.0","-3.2051706314086914"
"i turned half way round and saw dorian gray for the first time","1.0","1.737424373626709"
"when our eyes met, i felt that i was growing pale","1.0","2.1382396221160889"
"a curious sensation  of terror came over me","1.0","2.5569536685943604"
"i knew that i had come face to face with some  one whose mere personality was so fascinating that, if i allowed it to  do so, it would absorb my whole nature, my whole soul, my very art  itself","0.0","-1.7620439529418945"
"i did not want any external influence in my life","1.0","2.6205394268035889"
"you know  yourself, harry, how independent i am by nature","1.0","0.90458595752716064"
"i have always been my  own master  had at least always been so, till i met dorian gray","0.0","-1.2392640113830566"
"then  but i don't know how to explain it to you","0.0","-3.7740976810455322"
"something seemed to  tell me that i was on the verge of a terrible crisis in my life","1.0","0.47115546464920044"
"i had  a strange feeling that fate had in store for me exquisite joys and  exquisite sorrows","0.0","-2.2900679111480713"
"i grew afraid and turned to quit the room","0.0","-3.2096076011657715"
"it was  not conscience that made me do so   it was a sort of cowardice","0.0","-0.8877062201499939"
"i take  no credit to myself for trying to escape","0.0","-0.28257018327713013"
"conscience and cowardice are really the same things, basil","1.0","0.79905366897583008"
"conscience is the trade name of the firm","0.0","-0.48025292158126831"
"that is all","0.0","-0.091526053845882416"
"i don't believe that, harry, and i don't believe you do either","1.0","1.1475151777267456"
"however, whatever was my motive  and it may have been pride, for i used  to be very proud  i certainly struggled to the door","1.0","0.35796207189559937"
"there, of course,  i stumbled against lady brandon","1.0","3.1488938331604004"
"'you are not going to run away so  soon, mr","0.0","-4.9481306076049805"
"hallward?'","0.0","-1.4403764009475708"
"she screamed out","0.0","-0.20635658502578735"
"you know her curiously shrill  voice?","0.0","-1.6940547227859497"
"yes  she is a peacock in everything but beauty,  said lord henry,  pulling the daisy to bits with his long nervous fingers","0.0","-0.37476664781570435"
"i could not get rid of her","0.0","-0.73415416479110718"
"she brought me up to royalties, and  people with stars and garters, and elderly ladies with gigantic tiaras  and parrot noses","1.0","0.24446725845336914"
"she spoke of me as her dearest friend","0.0","-0.87151902914047241"
"i had only  met her once before, but she took it into her head to lionize me","0.0","-4.2047877311706543"
"i  believe some picture of mine had made a great success at the time, at  least had been chattered about in the penny newspapers, which is the  nineteenth century standard of immortality","0.0","-3.9866683483123779"
"suddenly i found myself  face to face with the young man whose personality had so strangely  stirred me","1.0","0.75199663639068604"
"we were quite close, almost touching","1.0","1.7250665426254272"
"our eyes met again","1.0","2.0264220237731934"
"it was reckless of me, but i asked lady brandon to introduce me to him","1.0","0.047168254852294922"
"perhaps it was not so reckless, after all","0.0","-4.5679588317871094"
"it was simply inevitable","0.0","-1.0553027391433716"
"we would have spoken to each other without any introduction","0.0","-1.8144092559814453"
"i am sure  of that","1.0","2.1335549354553223"
"dorian told me so afterwards","0.0","-2.3561501502990723"
"he, too, felt that we were  destined to know each other","1.0","0.033968552947044373"
"and how did lady brandon describe this wonderful young man?","1.0","4.3308372497558594"
"asked his  companion","1.0","1.7667236328125"
"i know she goes in for giving a rapid  precis  of all her  guests","1.0","1.9707608222961426"
"i remember her bringing me up to a truculent and red faced old  gentleman covered all over with orders and ribbons, and hissing into my  ear, in a tragic whisper which must have been perfectly audible to  everybody in the room, the most astounding details","1.0","1.1809015274047852"
"i simply fled","1.0","0.067812398076057434"
"i  like to find out people for myself","0.0","-1.3601548671722412"
"but lady brandon treats her guests  exactly as an auctioneer treats his goods","1.0","1.3740569353103638"
"she either explains them  entirely away, or tells one everything about them except what one wants  to know","0.0","-4.9434299468994141"
"poor lady brandon!","1.0","1.1280127763748169"
"you are hard on her, harry!","1.0","1.5450100898742676"
"said hallward  listlessly","0.0","-0.15398824214935303"
"my dear fellow, she tried to found a  salon , and only succeeded in  opening a restaurant","0.0","-0.44271409511566162"
"how could i admire her?","0.0","-2.1699872016906738"
"but tell me, what did  she say about mr  dorian gray?","0.0","-0.8788561224937439"
"oh, something like, 'charming boy  poor dear mother and i absolutely  inseparable","0.0","-1.0288987159729004"
"quite forget what he does  afraid he  doesn't do  anything  oh, yes, plays the piano  or is it the violin, dear mr","0.0","-3.3205585479736328"
"gray?'","0.0","-1.7495629787445068"
"neither of us could help laughing, and we became friends at  once","1.0","0.64236146211624146"
"laughter is not at all a bad beginning for a friendship, and it is far  the best ending for one,  said the young lord, plucking another daisy","0.0","-1.6237138509750366"
"hallward shook his head","0.0","-1.1372025012969971"
"you don't understand what friendship is,  harry,  he murmured   or what enmity is, for that matter","1.0","1.8682003021240234"
"you like  every one  that is to say, you are indifferent to every one","0.0","-2.2864933013916016"
"how horribly unjust of you!","1.0","1.6480846405029297"
"cried lord henry, tilting his hat back  and looking up at the little clouds that, like ravelled skeins of  glossy white silk, were drifting across the hollowed turquoise of the  summer sky","1.0","1.6239757537841797"
"yes  horribly unjust of you","1.0","0.47815695405006409"
"i make a great difference  between people","1.0","0.047008287161588669"
"i choose my friends for their good looks, my  acquaintances for their good characters, and my enemies for their good  intellects","1.0","0.64158308506011963"
"a man cannot be too careful in the choice of his enemies","1.0","0.13419726490974426"
"i have not got one who is a fool","0.0","-1.052332878112793"
"they are all men of some  intellectual power, and consequently they all appreciate me","0.0","-1.0835440158843994"
"is that  very vain of me?","0.0","-2.9405343532562256"
"i think it is rather vain","0.0","-2.5653033256530762"
"i should think it was, harry","0.0","-1.3651793003082275"
"but according to your category i must  be merely an acquaintance","1.0","1.0972790718078613"
"my dear old basil, you are much more than an acquaintance","0.0","-0.26125437021255493"
"and much less than a friend","0.0","-3.6425168514251709"
"a sort of brother, i suppose?","0.0","-9.619354248046875"
"oh, brothers!","1.0","0.8880772590637207"
"i don't care for brothers","0.0","-1.8182743787765503"
"my elder brother won't die,  and my younger brothers seem never to do anything else","0.0","-0.33996999263763428"
"harry!","1.0","0.72395968437194824"
"exclaimed hallward, frowning","1.0","0.72382867336273193"
"my dear fellow, i am not quite serious","1.0","2.4122145175933838"
"but i can't help detesting my  relations","1.0","1.3872849941253662"
"i suppose it comes from the fact that none of us can stand  other people having the same faults as ourselves","0.0","-2.1223921775817871"
"i quite sympathize  with the rage of the english democracy against what they call the vices  of the upper orders","1.0","5.2096395492553711"
"the masses feel that drunkenness, stupidity, and  immorality should be their own special property, and that if any one of  us makes an ass of himself, he is poaching on their preserves","0.0","-0.48524969816207886"
"when  poor southwark got into the divorce court, their indignation was quite  magnificent","1.0","0.79902064800262451"
"and yet i don't suppose that ten per cent of the  proletariat live correctly","0.0","-6.4642801284790039"
"i don't agree with a single word that you have said, and, what is  more, harry, i feel sure you don't either","1.0","0.26058116555213928"
