"Text","Binary_Sentiment","Cont_Sentiment"
"he kept his hands in  the pockets of his astrakhan coat, and seemed not to have noticed the  gesture with which he had been greeted","0.0","-0.59161138534545898"
"yes   it is a matter of life and death, alan, and to more than one  person","1.0","2.2732863426208496"
"sit down","0.0","-1.6088869571685791"
"campbell took a chair by the table, and dorian sat opposite to him","0.0","-8.3422279357910156"
"the two men's eyes met","1.0","0.30712795257568359"
"in dorian's there was infinite pity","0.0","-1.5251610279083252"
"he knew  that what he was going to do was dreadful","0.0","-2.7809500694274902"
"after a strained moment of silence, he leaned across and said, very  quietly, but watching the effect of each word upon the face of him he  had sent for,  alan, in a locked room at the top of this house, a room  to which nobody but myself has access, a dead man is seated at a table","0.0","-0.68427866697311401"
"he has been dead ten hours now","0.0","-1.189194917678833"
"don't stir, and don't look at me like  that","0.0","-1.2399237155914307"
"who the man is, why he died, how he died, are matters that do  not concern you","0.0","-1.4724671840667725"
"what you have to do is this        stop, gray","1.0","0.68037009239196777"
"i don't want to know anything further","0.0","-0.43165621161460876"
"whether what you  have told me is true or not true doesn't concern me","0.0","-0.78994488716125488"
"i entirely  decline to be mixed up in your life","0.0","-1.5224621295928955"
"keep your horrible secrets to  yourself","0.0","-3.4741315841674805"
"they don't interest me any more","0.0","-2.7926087379455566"
"alan, they will have to interest you","0.0","-1.2990450859069824"
"this one will have to interest  you","0.0","-3.4537398815155029"
"i am awfully sorry for you, alan","0.0","-3.4421818256378174"
"but i can't help myself","1.0","0.43062692880630493"
"you  are the one man who is able to save me","0.0","-3.3230991363525391"
"i am forced to bring you into  the matter","1.0","0.71480590105056763"
"i have no option","0.0","-5.524724006652832"
"alan, you are scientific","0.0","-0.79614317417144775"
"you know  about chemistry and things of that kind","0.0","-0.54027539491653442"
"you have made experiments","0.0","-3.6401083469390869"
"what you have got to do is to destroy the thing that is upstairs  to  destroy it so that not a vestige of it will be left","0.0","-3.370567798614502"
"nobody saw this  person come into the house","0.0","-1.047821044921875"
"indeed, at the present moment he is  supposed to be in paris","0.0","-5.1739330291748047"
"he will not be missed for months","0.0","-6.0108985900878906"
"when he is  missed, there must be no trace of him found here","0.0","-4.7238531112670898"
"you, alan, you must  change him, and everything that belongs to him, into a handful of ashes  that i may scatter in the air","1.0","1.7186033725738525"
"you are mad, dorian","1.0","0.66268134117126465"
"ah!","1.0","0.97132778167724609"
"i was waiting for you to call me dorian","0.0","-0.26666390895843506"
"you are mad, i tell you  mad to imagine that i would raise a finger to  help you, mad to make this monstrous confession","1.0","0.19210682809352875"
"i will have nothing  to do with this matter, whatever it is","0.0","-1.8453612327575684"
"do you think i am going to  peril my reputation for you?","1.0","2.2191359996795654"
"what is it to me what devil's work you  are up to?","1.0","0.21332742273807526"
"it was suicide, alan","1.0","0.42131209373474121"
"i am glad of that","1.0","2.8289251327514648"
"but who drove him to it?","0.0","-0.36804109811782837"
"you, i should fancy","1.0","0.95151209831237793"
"do you still refuse to do this for me?","0.0","-1.5460155010223389"
"of course i refuse","0.0","-2.542283296585083"
"i will have absolutely nothing to do with it","0.0","-2.2554793357849121"
"i  don't care what shame comes on you","0.0","-1.1620771884918213"
"you deserve it all","0.0","-1.9243147373199463"
"i should not  be sorry to see you disgraced, publicly disgraced","0.0","-2.6755046844482422"
"how dare you ask  me, of all men in the world, to mix myself up in this horror?","0.0","-0.35227882862091064"
"i should  have thought you knew more about people's characters","1.0","1.1699061393737793"
"your friend lord  henry wotton can't have taught you much about psychology, whatever else  he has taught you","0.0","-0.50178450345993042"
"nothing will induce me to stir a step to help you","0.0","-2.8710660934448242"
"you have come to the wrong man","0.0","-4.0576486587524414"
"go to some of your friends","1.0","0.92851221561431885"
"don't  come to me","0.0","-1.835864782333374"
"alan, it was murder","0.0","-0.61287188529968262"
"i killed him","1.0","0.82856118679046631"
"you don't know what he had made  me suffer","0.0","-5.4137277603149414"
"whatever my life is, he had more to do with the making or  the marring of it than poor harry has had","0.0","-1.3494677543640137"
"he may not have intended  it, the result was the same","0.0","-3.8325393199920654"
"murder!","1.0","0.5665888786315918"
"good god, dorian, is that what you have come to?","0.0","-1.0431866645812988"
"i shall not  inform upon you","0.0","-3.8704051971435547"
"it is not my business","0.0","-2.4148969650268555"
"besides, without my stirring  in the matter, you are certain to be arrested","1.0","0.92204141616821289"
"nobody ever commits a  crime without doing something stupid","0.0","-5.2017755508422852"
"but i will have nothing to do  with it","0.0","-2.7026636600494385"
"you must have something to do with it","1.0","0.80816614627838135"
"wait, wait a moment  listen to  me","0.0","-0.17098502814769745"
"only listen, alan","1.0","2.5543212890625"
"all i ask of you is to perform a certain  scientific experiment","0.0","-1.3697245121002197"
"you go to hospitals and dead houses, and the  horrors that you do there don't affect you","1.0","0.41326814889907837"
"if in some hideous  dissecting room or fetid laboratory you found this man lying on a  leaden table with red gutters scooped out in it for the blood to flow  through, you would simply look upon him as an admirable subject","0.0","-2.7528400421142578"
"you  would not turn a hair","0.0","-0.84583759307861328"
"you would not believe that you were doing  anything wrong","0.0","-3.7229938507080078"
"on the contrary, you would probably feel that you were  benefiting the human race, or increasing the sum of knowledge in the  world, or gratifying intellectual curiosity, or something of that kind","0.0","-1.0965365171432495"
"what i want you to do is merely what you have often done before","0.0","-0.3127979040145874"
"indeed, to destroy a body must be far less horrible than what you are  accustomed to work at","0.0","-4.0298833847045898"
"and, remember, it is the only piece of evidence  against me","1.0","0.89306026697158813"
"if it is discovered, i am lost  and it is sure to be  discovered unless you help me","0.0","-3.3599672317504883"
"i have no desire to help you","1.0","1.2180488109588623"
"you forget that","1.0","0.2041650116443634"
"i am simply  indifferent to the whole thing","0.0","-4.049828052520752"
"it has nothing to do with me","0.0","-0.99524176120758057"
"alan, i entreat you","1.0","3.1414523124694824"
"think of the position i am in","1.0","2.2501993179321289"
"just before you  came i almost fainted with terror","0.0","-0.39715898036956787"
"you may know terror yourself some  day","1.0","3.0473647117614746"
"no!","0.0","-0.65850985050201416"
"don't think of that","0.0","-0.68369615077972412"
"look at the matter purely from the  scientific point of view","0.0","-3.1655116081237793"
"you don't inquire where the dead things on  which you experiment come from","0.0","-0.8987085223197937"
"don't inquire now","0.0","-0.24405835568904877"
"i have told you  too much as it is","0.0","-3.1787590980529785"
"but i beg of you to do this","0.0","-0.11518888175487518"
"we were friends once,  alan","1.0","0.97824364900588989"
"don't speak about those days, dorian  they are dead","0.0","-1.8714841604232788"
"the dead linger sometimes","1.0","1.3887736797332764"
"the man upstairs will not go away","0.0","-0.69690358638763428"
"he is  sitting at the table with bowed head and outstretched arms","1.0","1.5412864685058594"
"alan!","1.0","1.7314138412475586"
"alan!","1.0","1.7314138412475586"
"if you don't come to my assistance, i am ruined","0.0","-0.67045503854751587"
"why, they will  hang me, alan!","1.0","2.1030678749084473"
"don't you understand?","0.0","-2.2554934024810791"
"they will hang me for what i  have done","0.0","-0.41066938638687134"
"there is no good in prolonging this scene","0.0","-0.98312139511108398"
"i absolutely refuse to do  anything in the matter","0.0","-2.0037908554077148"
"it is insane of you to ask me","1.0","4.8758635520935059"
"you refuse?","0.0","-3.7791342735290527"
"yes","0.0","-0.0057618096470832825"
"i entreat you, alan","1.0","3.5075259208679199"
"it is useless","0.0","-2.6548666954040527"
"the same look of pity came into dorian gray's eyes","1.0","1.3696181774139404"
"then he stretched  out his hand, took a piece of paper, and wrote something on it","0.0","-4.5994491577148438"
"he  read it over twice, folded it carefully, and pushed it across the  table","1.0","0.37269884347915649"
"having done this, he got up and went over to the window","0.0","-0.29229247570037842"
"campbell looked at him in surprise, and then took up the paper, and  opened it","0.0","-1.9511675834655762"
"as he read it, his face became ghastly pale and he fell  back in his chair","0.0","-3.638042688369751"
"a horrible sense of sickness came over him","0.0","-4.8405914306640625"
"he  felt as if his heart was beating itself to death in some empty hollow","0.0","-3.291872501373291"
"after two or three minutes of terrible silence, dorian turned round and  came and stood behind him, putting his hand upon his shoulder","0.0","-2.9577515125274658"
"i am so sorry for you, alan,  he murmured,  but you leave me no  alternative","0.0","-1.3552320003509521"
"i have a letter written already","0.0","-4.8460769653320312"
"here it is","0.0","-0.048053659498691559"
"you see  the address","1.0","1.852784276008606"
"if you don't help me, i must send it","1.0","3.4673423767089844"
"if you don't help  me, i will send it","1.0","1.761011004447937"
"you know what the result will be","0.0","-2.0256247520446777"
"but you are  going to help me","1.0","1.6182695627212524"
"it is impossible for you to refuse now","1.0","0.6395496129989624"
"i tried to  spare you","1.0","4.7614603042602539"
"you will do me the justice to admit that","0.0","-0.84990918636322021"
"you were stern,  harsh, offensive","0.0","-5.5665931701660156"
"you treated me as no man has ever dared to treat  me  no living man, at any rate","1.0","4.6073856353759766"
"i bore it all","0.0","-4.8513498306274414"
"now it is for me to  dictate terms","0.0","-1.7906451225280762"
"campbell buried his face in his hands, and a shudder passed through him","1.0","2.429283618927002"
"yes, it is my turn to dictate terms, alan","1.0","0.79957807064056396"
"you know what they are","1.0","0.53164970874786377"
"the thing is quite simple","0.0","-1.7853031158447266"
"come, don't work yourself into this fever","0.0","-5.0161600112915039"
"the thing has to be done","0.0","-0.081247851252555847"
"face it, and do it","1.0","1.4933943748474121"
"a groan broke from campbell's lips and he shivered all over","1.0","2.1467576026916504"
"the  ticking of the clock on the mantelpiece seemed to him to be dividing  time into separate atoms of agony, each of which was too terrible to be  borne","1.0","0.24118149280548096"
"he felt as if an iron ring was being slowly tightened round his  forehead, as if the disgrace with which he was threatened had already  come upon him","0.0","-2.8143088817596436"
"the hand upon his shoulder weighed like a hand of lead","0.0","-4.939598560333252"
"it was intolerable","0.0","-2.3390336036682129"
"it seemed to crush him","0.0","-3.4408178329467773"
"come, alan, you must decide at once","1.0","3.6170358657836914"
"i cannot do it,  he said, mechanically, as though words could alter  things","0.0","-0.95396202802658081"
"you must","1.0","1.0728033781051636"
"you have no choice","1.0","0.040473774075508118"
"don't delay","0.0","-4.4334726333618164"
"he hesitated a moment","0.0","-1.0947704315185547"
"is there a fire in the room upstairs?","0.0","-3.8757407665252686"
"yes, there is a gas fire with asbestos","1.0","1.2475237846374512"
"i shall have to go home and get some things from the laboratory","0.0","-3.6327378749847412"
"no, alan, you must not leave the house","1.0","3.4652628898620605"
"write out on a sheet of  notepaper what you want and my servant will take a cab and bring the  things back to you","1.0","1.4544401168823242"
"campbell scrawled a few lines, blotted them, and addressed an envelope  to his assistant","0.0","-1.7645595073699951"
"dorian took the note up and read it carefully","1.0","2.0108165740966797"
"then  he rang the bell and gave it to his valet, with orders to return as  soon as possible and to bring the things with him","1.0","0.56868016719818115"
"as the hall door shut, campbell started nervously, and having got up  from the chair, went over to the chimney piece","0.0","-0.21762996912002563"
"he was shivering with a  kind of ague","1.0","0.90785014629364014"
"for nearly twenty minutes, neither of the men spoke","0.0","-5.204833984375"
"a  fly buzzed noisily about the room, and the ticking of the clock was  like the beat of a hammer","0.0","-2.1719470024108887"
"as the chime struck one, campbell turned round, and looking at dorian  gray, saw that his eyes were filled with tears","1.0","1.6482701301574707"
"there was something in  the purity and refinement of that sad face that seemed to enrage him","1.0","2.2864913940429688"
"you are infamous, absolutely infamous!","1.0","2.3843975067138672"
"he muttered","0.0","-0.021075375378131866"
"hush, alan","1.0","3.1226825714111328"
"you have saved my life,  said dorian","1.0","0.58402073383331299"
"your life?","0.0","-0.0021026469767093658"
"good heavens!","1.0","1.5240175724029541"
"what a life that is!","1.0","3.8030953407287598"
"you have gone from  corruption to corruption, and now you have culminated in crime","1.0","7.2332291603088379"
"in  doing what i am going to do  what you force me to do  it is not of your  life that i am thinking","1.0","3.1238722801208496"
"ah, alan,  murmured dorian with a sigh,  i wish you had a thousandth  part of the pity for me that i have for you","1.0","3.7440383434295654"
"he turned away as he  spoke and stood looking out at the garden","0.0","-2.7631993293762207"
"campbell made no answer","0.0","-6.8737773895263672"
"after about ten minutes a knock came to the door, and the servant  entered, carrying a large mahogany chest of chemicals, with a long coil  of steel and platinum wire and two rather curiously shaped iron clamps","1.0","0.17852526903152466"
"shall i leave the things here, sir?","0.0","-3.8727936744689941"
"he asked campbell","0.0","-1.1943295001983643"
"yes,  said dorian","0.0","-0.674308180809021"
"and i am afraid, francis, that i have another  errand for you","1.0","1.8354997634887695"
"what is the name of the man at richmond who supplies  selby with orchids?","1.0","2.6489613056182861"
"harden, sir","0.0","-1.0775146484375"
"yes  harden","1.0","0.25361919403076172"
"you must go down to richmond at once, see harden  personally, and tell him to send twice as many orchids as i ordered,  and to have as few white ones as possible","0.0","-0.402992844581604"
"in fact, i don't want any  white ones","0.0","-0.46691226959228516"
"it is a lovely day, francis, and richmond is a very pretty  place  otherwise i wouldn't bother you about it","1.0","0.5512346625328064"
"no trouble, sir","0.0","-1.6857290267944336"
"at what time shall i be back?","0.0","-2.806006908416748"
"dorian looked at campbell","0.0","-3.2254843711853027"
"how long will your experiment take, alan?","1.0","2.6112964153289795"
"he said in a calm indifferent voice","1.0","1.0005552768707275"
"the presence of a third person in  the room seemed to give him extraordinary courage","0.0","-2.8236336708068848"
"campbell frowned and bit his lip","1.0","3.2602889537811279"
"it will take about five hours,  he  answered","1.0","0.47998890280723572"
"it will be time enough, then, if you are back at half past seven,  francis","0.0","-0.34669661521911621"
"or stay   just leave my things out for dressing","0.0","-5.153285026550293"
"you can  have the evening to yourself","0.0","-1.2429986000061035"
"i am not dining at home, so i shall not  want you","0.0","-3.8018598556518555"
"thank you, sir,  said the man, leaving the room","0.0","-0.97774022817611694"
"now, alan, there is not a moment to be lost","0.0","-0.53331881761550903"
"how heavy this chest is!","0.0","-2.7790079116821289"
"i'll take it for you","1.0","2.3449182510375977"
"you bring the other things","0.0","-0.75786101818084717"
"he spoke rapidly  and in an authoritative manner","1.0","2.143282413482666"
"campbell felt dominated by him","0.0","-0.58195042610168457"
"they  left the room together","0.0","-4.8094029426574707"
"when they reached the top landing, dorian took out the key and turned  it in the lock","1.0","1.2781964540481567"
"then he stopped, and a troubled look came into his  eyes","1.0","0.66689932346343994"
"he shuddered","0.0","-0.021075375378131866"
"i don't think i can go in, alan,  he murmured","1.0","1.9249193668365479"
"it is nothing to me","0.0","-2.8901176452636719"
"i don't require you,  said campbell coldly","0.0","-0.49586641788482666"
"dorian half opened the door","0.0","-0.010923609137535095"
"as he did so, he saw the face of his  portrait leering in the sunlight","1.0","0.97482633590698242"
"on the floor in front of it the torn  curtain was lying","0.0","-0.24984985589981079"
"he remembered that the night before he had  forgotten, for the first time in his life, to hide the fatal canvas,  and was about to rush forward, when he drew back with a shudder","0.0","-0.60769414901733398"
"what was that loathsome red dew that gleamed, wet and glistening, on  one of the hands, as though the canvas had sweated blood?","0.0","-1.6246423721313477"
"how horrible  it was!  more horrible, it seemed to him for the moment, than the  silent thing that he knew was stretched across the table, the thing  whose grotesque misshapen shadow on the spotted carpet showed him that  it had not stirred, but was still there, as he had left it","0.0","-2.9464926719665527"
"he heaved a deep breath, opened the door a little wider, and with  half closed eyes and averted head, walked quickly in, determined that  he would not look even once upon the dead man","1.0","1.3864538669586182"
"then, stooping down and  taking up the gold and purple hanging, he flung it right over the  picture","1.0","0.25659626722335815"
"there he stopped, feeling afraid to turn round, and his eyes fixed  themselves on the intricacies of the pattern before him","1.0","0.82210695743560791"
"he heard  campbell bringing in the heavy chest, and the irons, and the other  things that he had required for his dreadful work","0.0","-0.21506717801094055"
"he began to wonder  if he and basil hallward had ever met, and, if so, what they had  thought of each other","0.0","-1.0430834293365479"
"leave me now,  said a stern voice behind him","0.0","-2.9132544994354248"
"he turned and hurried out, just conscious that the dead man had been  thrust back into the chair and that campbell was gazing into a  glistening yellow face","0.0","-2.266289234161377"
"as he was going downstairs, he heard the key  being turned in the lock","0.0","-1.4517571926116943"
"it was long after seven when campbell came back into the library","0.0","-1.3053262233734131"
"he  was pale, but absolutely calm","1.0","2.9200494289398193"
"i have done what you asked me to do,   he muttered","0.0","-1.1254650354385376"
"and now, good bye","1.0","2.7468721866607666"
"let us never see each other again","1.0","1.6812596321105957"
"you have saved me from ruin, alan","1.0","2.5052695274353027"
"i cannot forget that,  said dorian  simply","0.0","-1.2055521011352539"
"as soon as campbell had left, he went upstairs","0.0","-4.7949151992797852"
"there was a horrible  smell of nitric acid in the room","0.0","-4.4151883125305176"
"but the thing that had been sitting  at the table was gone","0.0","-5.8505754470825195"
"chapter 15    that evening, at eight thirty, exquisitely dressed and wearing a large  button hole of parma violets, dorian gray was ushered into lady  narborough's drawing room by bowing servants","0.0","-4.5963277816772461"
"his forehead was  throbbing with maddened nerves, and he felt wildly excited, but his  manner as he bent over his hostess's hand was as easy and graceful as  ever","0.0","-3.2096362113952637"
"perhaps one never seems so much at one's ease as when one has to  play a part","0.0","-1.559065580368042"
"certainly no one looking at dorian gray that night could  have believed that he had passed through a tragedy as horrible as any  tragedy of our age","0.0","-1.3979939222335815"
"those finely shaped fingers could never have  clutched a knife for sin, nor those smiling lips have cried out on god  and goodness","1.0","0.76278042793273926"
"he himself could not help wondering at the calm of his  demeanour, and for a moment felt keenly the terrible pleasure of a  double life","1.0","2.5873467922210693"
"it was a small party, got up rather in a hurry by lady narborough, who  was a very clever woman with what lord henry used to describe as the  remains of really remarkable ugliness","1.0","2.4448056221008301"
"she had proved an excellent  wife to one of our most tedious ambassadors, and having buried her  husband properly in a marble mausoleum, which she had herself designed,  and married off her daughters to some rich, rather elderly men, she  devoted herself now to the pleasures of french fiction, french cookery,  and french  esprit  when she could get it","0.0","-1.9924057722091675"
"dorian was one of her especial favourites, and she always told him that  she was extremely glad she had not met him in early life","0.0","-4.0643587112426758"
"i know, my  dear, i should have fallen madly in love with you,  she used to say,   and thrown my bonnet right over the mills for your sake","0.0","-1.4555974006652832"
"it is most  fortunate that you were not thought of at the time","1.0","0.87802278995513916"
"as it was, our  bonnets were so unbecoming, and the mills were so occupied in trying to  raise the wind, that i never had even a flirtation with anybody","1.0","0.35191959142684937"
"however, that was all narborough's fault","0.0","-5.2840023040771484"
"he was dreadfully  short sighted, and there is no pleasure in taking in a husband who  never sees anything","1.0","1.1889181137084961"
"her guests this evening were rather tedious","0.0","-5.7696466445922852"
"the fact was, as she  explained to dorian, behind a very shabby fan, one of her married  daughters had come up quite suddenly to stay with her, and, to make  matters worse, had actually brought her husband with her","0.0","-1.5880697965621948"
"i think it  is most unkind of her, my dear,  she whispered","0.0","-0.53063499927520752"
"of course i go and  stay with them every summer after i come from homburg, but then an old  woman like me must have fresh air sometimes, and besides, i really wake  them up","0.0","-0.44952106475830078"
"you don't know what an existence they lead down there","0.0","-2.3957135677337646"
"it is  pure unadulterated country life","1.0","6.5489177703857422"
"they get up early, because they have  so much to do, and go to bed early, because they have so little to  think about","0.0","-2.8927874565124512"
"there has not been a scandal in the neighbourhood since  the time of queen elizabeth, and consequently they all fall asleep  after dinner","0.0","-9.1498336791992188"
"you shan't sit next either of them","0.0","-4.7359733581542969"
"you shall sit by me  and amuse me","0.0","-2.7815797328948975"
"dorian murmured a graceful compliment and looked round the room","0.0","-1.3200042247772217"
"yes   it was certainly a tedious party","0.0","-5.3164081573486328"
"two of the people he had never seen  before, and the others consisted of ernest harrowden, one of those  middle aged mediocrities so common in london clubs who have no enemies,  but are thoroughly disliked by their friends  lady ruxton, an  overdressed woman of forty seven, with a hooked nose, who was always  trying to get herself compromised, but was so peculiarly plain that to  her great disappointment no one would ever believe anything against  her  mrs  erlynne, a pushing nobody, with a delightful lisp and  venetian red hair  lady alice chapman, his hostess's daughter, a dowdy  dull girl, with one of those characteristic british faces that, once  seen, are never remembered  and her husband, a red cheeked,  white whiskered creature who, like so many of his class, was under the  impression that inordinate joviality can atone for an entire lack of  ideas","0.0","-1.7948992252349854"
"he was rather sorry he had come, till lady narborough, looking at the  great ormolu gilt clock that sprawled in gaudy curves on the  mauve draped mantelshelf, exclaimed    how horrid of henry wotton to be  so late!","0.0","-0.78351008892059326"
"i sent round to him this morning on chance and he promised  faithfully not to disappoint me","1.0","1.3862004280090332"
